root@lamponubuntu2004-s-1vcpu-1gb-tor1-01:~# tcpdump -i eth0 tcp
tcpdump: verbose output suppressed, use -v or -vv for full protocol decode
listening on eth0, link-type EN10MB (Ethernet), capture size 262144 bytes
18:46:08.440825 IP lamponubuntu2004-s-1vcpu-1gb-tor1-01.ssh > bras-base-toroon0560w-grc-73-184-146-17-164.dsl.bell.ca.36152: Flags [P.], seq 3769244997:3769245105, ack 1609534529, win 501, options [nop,nop,TS val 844235057 ecr 3768358527], length 108
18:46:08.440969 IP lamponubuntu2004-s-1vcpu-1gb-tor1-01.ssh > bras-base-toroon0560w-grc-73-184-146-17-164.dsl.bell.ca.36152: Flags [P.], seq 108:144, ack 1, win 501, options [nop,nop,TS val 844235057 ecr 3768358527], length 36
18:46:08.441086 IP lamponubuntu2004-s-1vcpu-1gb-tor1-01.ssh > bras-base-toroon0560w-grc-73-184-146-17-164.dsl.bell.ca.36152: Flags [P.], seq 144:252, ack 1, win 501, options [nop,nop,TS val 844235057 ecr 3768358527], length 108
18:46:08.441175 IP lamponubuntu2004-s-1vcpu-1gb-tor1-01.ssh > bras-base-toroon0560w-grc-73-184-146-17-164.dsl.bell.ca.36152: Flags [P.], seq 252:288, ack 1, win 501, options [nop,nop,TS val 844235057 ecr 3768358527], length 36
18:46:08.446362 IP lamponubuntu2004-s-1vcpu-1gb-tor1-01.ssh > bras-base-toroon0560w-grc-73-184-146-17-164.dsl.bell.ca.36152: Flags [P.], seq 288:572, ack 1, win 501, options [nop,nop,TS val 844235062 ecr 3768358527], length 284
18:46:08.446468 IP bras-base-toroon0560w-grc-73-184-146-17-164.dsl.bell.ca.36152 > lamponubuntu2004-s-1vcpu-1gb-tor1-01.ssh: Flags [.], ack 0, win 7555, options [nop,nop,TS val 3768358532 ecr 844235032], length 0
18:46:08.446537 IP lamponubuntu2004-s-1vcpu-1gb-tor1-01.ssh > bras-base-toroon0560w-grc-73-184-146-17-164.dsl.bell.ca.36152: Flags [P.], seq 572:608, ack 1, win 501, options [nop,nop,TS val 844235063 ecr 3768358532], length 36
18:46:08.446678 IP lamponubuntu2004-s-1vcpu-1gb-tor1-01.ssh > bras-base-toroon0560w-grc-73-184-146-17-164.dsl.bell.ca.36152: Flags [P.], seq 608:868, ack 1, win 501, options [nop,nop,TS val 844235063 ecr 3768358532], length 260
18:46:08.446776 IP lamponubuntu2004-s-1vcpu-1gb-tor1-01.ssh > bras-base-toroon0560w-grc-73-184-146-17-164.dsl.bell.ca.36152: Flags [P.], seq 868:904, ack 1, win 501, options [nop,nop,TS val 844235063 ecr 3768358532], length 36
18:46:08.446900 IP lamponubuntu2004-s-1vcpu-1gb-tor1-01.ssh > bras-base-toroon0560w-grc-73-184-146-17-164.dsl.bell.ca.36152: Flags [P.], seq 904:1172, ack 1, win 501, options [nop,nop,TS val 844235063 ecr 3768358532], length 268
18:46:08.446965 IP bras-base-toroon0560w-grc-73-184-146-17-164.dsl.bell.ca.36152 > lamponubuntu2004-s-1vcpu-1gb-tor1-01.ssh: Flags [.], ack 108, win 7555, options [nop,nop,TS val 3768358556 ecr 844235057], length 0
18:46:08.446965 IP bras-base-toroon0560w-grc-73-184-146-17-164.dsl.bell.ca.36152 > lamponubuntu2004-s-1vcpu-1gb-tor1-01.ssh: Flags [.], ack 144, win 7555, options [nop,nop,TS val 3768358556 ecr 844235057], length 0
18:46:08.446965 IP bras-base-toroon0560w-grc-73-184-146-17-164.dsl.bell.ca.36152 > lamponubuntu2004-s-1vcpu-1gb-tor1-01.ssh: Flags [.], ack 252, win 7555, options [nop,nop,TS val 3768358556 ecr 844235057], length 0
18:46:08.446965 IP bras-base-toroon0560w-grc-73-184-146-17-164.dsl.bell.ca.36152 > lamponubuntu2004-s-1vcpu-1gb-tor1-01.ssh: Flags [.], ack 288, win 7555, options [nop,nop,TS val 3768358556 ecr 844235057], length 0
18:46:08.447067 IP lamponubuntu2004-s-1vcpu-1gb-tor1-01.ssh > bras-base-toroon0560w-grc-73-184-146-17-164.dsl.bell.ca.36152: Flags [P.], seq 1172:1208, ack 1, win 501, options [nop,nop,TS val 844235063 ecr 3768358556], length 36
18:46:08.447197 IP lamponubuntu2004-s-1vcpu-1gb-tor1-01.ssh > bras-base-toroon0560w-grc-73-184-146-17-164.dsl.bell.ca.36152: Flags [P.], seq 1208:1468, ack 1, win 501, options [nop,nop,TS val 844235063 ecr 3768358556], length 260
18:46:08.447320 IP lamponubuntu2004-s-1vcpu-1gb-tor1-01.ssh > bras-base-toroon0560w-grc-73-184-146-17-164.dsl.bell.ca.36152: Flags [P.], seq 1468:1504, ack 1, win 501, options [nop,nop,TS val 844235063 ecr 3768358556], length 36
18:46:08.447462 IP lamponubuntu2004-s-1vcpu-1gb-tor1-01.ssh > bras-base-toroon0560w-grc-73-184-146-17-164.dsl.bell.ca.36152: Flags [P.], seq 1504:1772, ack 1, win 501, options [nop,nop,TS val 844235063 ecr 3768358556], length 268
18:46:08.447557 IP lamponubuntu2004-s-1vcpu-1gb-tor1-01.ssh > bras-base-toroon0560w-grc-73-184-146-17-164.dsl.bell.ca.36152: Flags [P.], seq 1772:1808, ack 1, win 501, options [nop,nop,TS val 844235064 ecr 3768358556], length 36
18:46:08.447684 IP lamponubuntu2004-s-1vcpu-1gb-tor1-01.ssh > bras-base-toroon0560w-grc-73-184-146-17-164.dsl.bell.ca.36152: Flags [P.], seq 1808:2060, ack 1, win 501, options [nop,nop,TS val 844235064 ecr 3768358556], length 252
18:46:08.447811 IP lamponubuntu2004-s-1vcpu-1gb-tor1-01.ssh > bras-base-toroon0560w-grc-73-184-146-17-164.dsl.bell.ca.36152: Flags [P.], seq 2060:2096, ack 1, win 501, options [nop,nop,TS val 844235064 ecr 3768358556], length 36
18:46:08.447947 IP lamponubuntu2004-s-1vcpu-1gb-tor1-01.ssh > bras-base-toroon0560w-grc-73-184-146-17-164.dsl.bell.ca.36152: Flags [P.], seq 2096:2356, ack 1, win 501, options [nop,nop,TS val 844235064 ecr 3768358556], length 260
18:46:08.448040 IP lamponubuntu2004-s-1vcpu-1gb-tor1-01.ssh > bras-base-toroon0560w-grc-73-184-146-17-164.dsl.bell.ca.36152: Flags [P.], seq 2356:2392, ack 1, win 501, options [nop,nop,TS val 844235064 ecr 3768358556], length 36
18:46:08.448315 IP lamponubuntu2004-s-1vcpu-1gb-tor1-01.ssh > bras-base-toroon0560w-grc-73-184-146-17-164.dsl.bell.ca.36152: Flags [P.], seq 2392:2660, ack 1, win 501, options [nop,nop,TS val 844235064 ecr 3768358556], length 268
18:46:08.451053 IP bras-base-toroon0560w-grc-73-184-146-17-164.dsl.bell.ca.36152 > lamponubuntu2004-s-1vcpu-1gb-tor1-01.ssh: Flags [.], ack 572, win 7555, options [nop,nop,TS val 3768358562 ecr 844235062], length 0
18:46:08.451053 IP bras-base-toroon0560w-grc-73-184-146-17-164.dsl.bell.ca.36152 > lamponubuntu2004-s-1vcpu-1gb-tor1-01.ssh: Flags [.], ack 608, win 7555, options [nop,nop,TS val 3768358562 ecr 844235063], length 0
18:46:08.451053 IP bras-base-toroon0560w-grc-73-184-146-17-164.dsl.bell.ca.36152 > lamponubuntu2004-s-1vcpu-1gb-tor1-01.ssh: Flags [.], ack 868, win 7553, options [nop,nop,TS val 3768358562 ecr 844235063], length 0
18:46:08.451053 IP bras-base-toroon0560w-grc-73-184-146-17-164.dsl.bell.ca.36152 > lamponubuntu2004-s-1vcpu-1gb-tor1-01.ssh: Flags [.], ack 904, win 7553, options [nop,nop,TS val 3768358562 ecr 844235063], length 0
18:46:08.451053 IP bras-base-toroon0560w-grc-73-184-146-17-164.dsl.bell.ca.36152 > lamponubuntu2004-s-1vcpu-1gb-tor1-01.ssh: Flags [.], ack 1172, win 7551, options [nop,nop,TS val 3768358562 ecr 844235063], length 0
18:46:08.451053 IP bras-base-toroon0560w-grc-73-184-146-17-164.dsl.bell.ca.36152 > lamponubuntu2004-s-1vcpu-1gb-tor1-01.ssh: Flags [.], ack 1208, win 7551, options [nop,nop,TS val 3768358562 ecr 844235063], length 0
18:46:08.451053 IP bras-base-toroon0560w-grc-73-184-146-17-164.dsl.bell.ca.36152 > lamponubuntu2004-s-1vcpu-1gb-tor1-01.ssh: Flags [.], ack 1468, win 7549, options [nop,nop,TS val 3768358562 ecr 844235063], length 0
18:46:08.451054 IP bras-base-toroon0560w-grc-73-184-146-17-164.dsl.bell.ca.36152 > lamponubuntu2004-s-1vcpu-1gb-tor1-01.ssh: Flags [.], ack 1504, win 7549, options [nop,nop,TS val 3768358562 ecr 844235063], length 0
18:46:08.451131 IP lamponubuntu2004-s-1vcpu-1gb-tor1-01.ssh > bras-base-toroon0560w-grc-73-184-146-17-164.dsl.bell.ca.36152: Flags [P.], seq 2660:5540, ack 1, win 501, options [nop,nop,TS val 844235067 ecr 3768358562], length 2880
18:46:08.451175 IP lamponubuntu2004-s-1vcpu-1gb-tor1-01.ssh > bras-base-toroon0560w-grc-73-184-146-17-164.dsl.bell.ca.36152: Flags [P.], seq 5540:7488, ack 1, win 501, options [nop,nop,TS val 844235067 ecr 3768358562], length 1948
18:46:08.451218 IP bras-base-toroon0560w-grc-73-184-146-17-164.dsl.bell.ca.36152 > lamponubuntu2004-s-1vcpu-1gb-tor1-01.ssh: Flags [.], ack 1772, win 7547, options [nop,nop,TS val 3768358562 ecr 844235063], length 0
18:46:08.451218 IP bras-base-toroon0560w-grc-73-184-146-17-164.dsl.bell.ca.36152 > lamponubuntu2004-s-1vcpu-1gb-tor1-01.ssh: Flags [.], ack 1808, win 7547, options [nop,nop,TS val 3768358562 ecr 844235064], length 0
18:46:08.451218 IP bras-base-toroon0560w-grc-73-184-146-17-164.dsl.bell.ca.36152 > lamponubuntu2004-s-1vcpu-1gb-tor1-01.ssh: Flags [.], ack 2060, win 7546, options [nop,nop,TS val 3768358562 ecr 844235064], length 0
18:46:08.451218 IP bras-base-toroon0560w-grc-73-184-146-17-164.dsl.bell.ca.36152 > lamponubuntu2004-s-1vcpu-1gb-tor1-01.ssh: Flags [.], ack 2096, win 7555, options [nop,nop,TS val 3768358562 ecr 844235064], length 0
18:46:08.451400 IP lamponubuntu2004-s-1vcpu-1gb-tor1-01.ssh > bras-base-toroon0560w-grc-73-184-146-17-164.dsl.bell.ca.36152: Flags [P.], seq 7488:7740, ack 1, win 501, options [nop,nop,TS val 844235067 ecr 3768358562], length 252
18:46:08.451584 IP lamponubuntu2004-s-1vcpu-1gb-tor1-01.ssh > bras-base-toroon0560w-grc-73-184-146-17-164.dsl.bell.ca.36152: Flags [P.], seq 7740:8028, ack 1, win 501, options [nop,nop,TS val 844235068 ecr 3768358562], length 288
18:46:08.451756 IP lamponubuntu2004-s-1vcpu-1gb-tor1-01.ssh > bras-base-toroon0560w-grc-73-184-146-17-164.dsl.bell.ca.36152: Flags [P.], seq 8028:8316, ack 1, win 501, options [nop,nop,TS val 844235068 ecr 3768358562], length 288
18:46:08.451822 IP lamponubuntu2004-s-1vcpu-1gb-tor1-01.ssh > bras-base-toroon0560w-grc-73-184-146-17-164.dsl.bell.ca.36152: Flags [P.], seq 8316:8352, ack 1, win 501, options [nop,nop,TS val 844235068 ecr 3768358562], length 36
18:46:08.451941 IP lamponubuntu2004-s-1vcpu-1gb-tor1-01.ssh > bras-base-toroon0560w-grc-73-184-146-17-164.dsl.bell.ca.36152: Flags [P.], seq 8352:8604, ack 1, win 501, options [nop,nop,TS val 844235068 ecr 3768358562], length 252
18:46:08.452033 IP lamponubuntu2004-s-1vcpu-1gb-tor1-01.ssh > bras-base-toroon0560w-grc-73-184-146-17-164.dsl.bell.ca.36152: Flags [P.], seq 8604:8640, ack 1, win 501, options [nop,nop,TS val 844235068 ecr 3768358562], length 36
18:46:08.452211 IP lamponubuntu2004-s-1vcpu-1gb-tor1-01.ssh > bras-base-toroon0560w-grc-73-184-146-17-164.dsl.bell.ca.36152: Flags [P.], seq 8640:8892, ack 1, win 501, options [nop,nop,TS val 844235068 ecr 3768358562], length 252
18:46:08.452310 IP lamponubuntu2004-s-1vcpu-1gb-tor1-01.ssh > bras-base-toroon0560w-grc-73-184-146-17-164.dsl.bell.ca.36152: Flags [P.], seq 8892:8928, ack 1, win 501, options [nop,nop,TS val 844235068 ecr 3768358562], length 36
18:46:08.452462 IP lamponubuntu2004-s-1vcpu-1gb-tor1-01.ssh > bras-base-toroon0560w-grc-73-184-146-17-164.dsl.bell.ca.36152: Flags [P.], seq 8928:9180, ack 1, win 501, options [nop,nop,TS val 844235068 ecr 3768358562], length 252
