root@lamponubuntu2004-s-1vcpu-1gb-tor1-01:~# tcpdump -A -i eth0
tcpdump: verbose output suppressed, use -v or -vv for full protocol decode
listening on eth0, link-type EN10MB (Ethernet), capture size 262144 bytes
18:42:36.552000 IP lamponubuntu2004-s-1vcpu-1gb-tor1-01.ssh > bras-base-toroon0560w-grc-73-184-146-17-164.dsl.bell.ca.36152: Flags [P.], seq 3766627273:3766627381, ack 1609530217, win 501, options [nop,nop,TS val 844023168 ecr 3768146645], length 108
E...^T@.@.O..."m.......8..+._.{i...........
2N....Z..cB@..qGc1.>C...0........<.&.....>w...f.....1..{...\.G..]YR.
..'^.v._.$6..}.gI.u..Jr'%.$..nj.....2.C../.JI..
18:42:36.552237 IP lamponubuntu2004-s-1vcpu-1gb-tor1-01.ssh > bras-base-toroon0560w-grc-73-184-146-17-164.dsl.bell.ca.36152: Flags [P.], seq 108:252, ack 1, win 501, options [nop,nop,TS val 844023168 ecr 3768146645], length 144
E...^U@.@.O`.."m.......8..,5_.{i.....%.....
2N....Z...H.(A.8@	/8...-.yc...^....>Fm...35...e...6....N...hJ..0.D.-.a.2. ...HfK...!O.]Q...^.t.1.ek	..x..4. Jd'.&.car...q...2...=.p.{.K.....V.......l...
18:42:36.552372 IP lamponubuntu2004-s-1vcpu-1gb-tor1-01.ssh > bras-base-toroon0560w-grc-73-184-146-17-164.dsl.bell.ca.36152: Flags [P.], seq 252:288, ack 1, win 501, options [nop,nop,TS val 844023168 ecr 3768146645], length 36
E..X^V@.@.O..."m.......8..,._.{i...........
2N....Z....)..D.. ...	..j..o\.....q9...V.*D.
18:42:36.553629 IP lamponubuntu2004-s-1vcpu-1gb-tor1-01.56968 > 67.207.67.2.domain: 6194+ [1au] PTR? 164.17.146.184.in-addr.arpa. (56)
E..T..@.@.'..."mC.C....5.@I[.2...........164.17.146.184.in-addr.arpa.......)........
18:42:36.553751 IP lamponubuntu2004-s-1vcpu-1gb-tor1-01.52115 > 67.207.67.2.domain: 28965+ [1au] PTR? 164.17.146.184.in-addr.arpa. (56)
E..T..@.@.'..."mC.C....5.@I[q%...........164.17.146.184.in-addr.arpa.......)........
18:42:36.554590 IP lamponubuntu2004-s-1vcpu-1gb-tor1-01.43093 > 67.207.67.2.domain: 35889+ [1au] PTR? 109.34.203.159.in-addr.arpa. (56)
E..T..@.@.'..."mC.C..U.5.@I[.1...........109.34.203.159.in-addr.arpa.......)........
18:42:36.554708 IP lamponubuntu2004-s-1vcpu-1gb-tor1-01.48174 > 67.207.67.2.domain: 23100+ [1au] PTR? 109.34.203.159.in-addr.arpa. (56)
E..T..@.@.'..."mC.C....5.@I[Z<...........109.34.203.159.in-addr.arpa.......)........
18:42:36.554836 IP lamponubuntu2004-s-1vcpu-1gb-tor1-01.39474 > 67.207.67.2.domain: 47089+ [1au] PTR? 109.34.203.159.in-addr.arpa. (56)
E..T..@.@.'..."mC.C..2.5.@I[.............109.34.203.159.in-addr.arpa.......)........
18:42:36.555076 IP 67.207.67.2.domain > lamponubuntu2004-s-1vcpu-1gb-tor1-01.56968: 6194 1/0/1 PTR bras-base-toroon0560w-grc-73-184-146-17-164.dsl.bell.ca. (125)
E...v.@.?.{.C.C..."m.5.....^.2...........164.17.146.184.in-addr.arpa.............P..9+bras-base-toroon0560w-grc-73-184-146-17-164.dsl.bell.ca...)........
18:42:36.555115 IP lamponubuntu2004-s-1vcpu-1gb-tor1-01 > 67.207.67.2: ICMP lamponubuntu2004-s-1vcpu-1gb-tor1-01 udp port 56968 unreachable, length 161
E.......@.<..."mC.C...F.....E...v.@.?.{.C.C..."m.5.....^.2...........164.17.146.184.in-addr.arpa.............P..9+bras-base-toroon0560w-grc-73-184-146-17-164.dsl.bell.ca...)........
18:42:36.555790 IP 67.207.67.2.domain > lamponubuntu2004-s-1vcpu-1gb-tor1-01.52115: 28965 1/0/1 PTR bras-base-toroon0560w-grc-73-184-146-17-164.dsl.bell.ca. (125)
E...v.@.?.{.C.C..."m.5....z`q%...........164.17.146.184.in-addr.arpa.............P..9+bras-base-toroon0560w-grc-73-184-146-17-164.dsl.bell.ca...)........
18:42:36.555790 IP 67.207.67.2.domain > lamponubuntu2004-s-1vcpu-1gb-tor1-01.43093: 35889 NXDomain 0/1/1 (123)
E...v.@.?.{.C.C..."m.5.U.....1...........109.34.203.159.in-addr.arpa..............|.7.ns1.digitalocean.com.
hostmaster..a..)..*0.....	:.......)........
18:42:36.555790 IP 67.207.67.2.domain > lamponubuntu2004-s-1vcpu-1gb-tor1-01.48174: 23100 NXDomain 0/1/1 (123)
E...v.@.?.{.C.C..."m.5......Z<...........109.34.203.159.in-addr.arpa..............|.7.ns1.digitalocean.com.
hostmaster..a..)..*0.....	:.......)........
18:42:36.555791 IP bras-base-toroon0560w-grc-73-184-146-17-164.dsl.bell.ca.36152 > lamponubuntu2004-s-1vcpu-1gb-tor1-01.ssh: Flags [.], ack 108, win 7555, options [nop,nop,TS val 3768146667 ecr 844023168], length 0
E..4..@.5..S......"m.8.._.{i..,5....$......
..Z.2N..
18:42:36.555791 IP bras-base-toroon0560w-grc-73-184-146-17-164.dsl.bell.ca.36152 > lamponubuntu2004-s-1vcpu-1gb-tor1-01.ssh: Flags [.], ack 252, win 7554, options [nop,nop,TS val 3768146667 ecr 844023168], length 0
E..4..@.5..R......"m.8.._.{i..,.....#......
..Z.2N..
18:42:36.555791 IP bras-base-toroon0560w-grc-73-184-146-17-164.dsl.bell.ca.36152 > lamponubuntu2004-s-1vcpu-1gb-tor1-01.ssh: Flags [.], ack 288, win 7554, options [nop,nop,TS val 3768146667 ecr 844023168], length 0
E..4..@.5..Q......"m.8.._.{i..,.....#e.....
..Z.2N..
18:42:36.555791 IP 67.207.67.2.domain > lamponubuntu2004-s-1vcpu-1gb-tor1-01.39474: 47089 NXDomain 0/1/1 (123)
E...v.@.?.{.C.C..."m.5.2..r..............109.34.203.159.in-addr.arpa..............|.7.ns1.digitalocean.com.
hostmaster..a..)..*0.....	:.......)........
18:42:36.555857 IP lamponubuntu2004-s-1vcpu-1gb-tor1-01 > 67.207.67.2: ICMP lamponubuntu2004-s-1vcpu-1gb-tor1-01 udp port 52115 unreachable, length 161
E.......@.<..."mC.C...F.....E...v.@.?.{.C.C..."m.5....z`q%...........164.17.146.184.in-addr.arpa.............P..9+bras-base-toroon0560w-grc-73-184-146-17-164.dsl.bell.ca...)........
18:42:36.556347 IP lamponubuntu2004-s-1vcpu-1gb-tor1-01.43093 > 67.207.67.2.domain: 35889+ PTR? 109.34.203.159.in-addr.arpa. (45)
E..I..@.@.'..."mC.C..U.5.5IP.1...........109.34.203.159.in-addr.arpa.....
18:42:36.556540 IP lamponubuntu2004-s-1vcpu-1gb-tor1-01.39474 > 67.207.67.2.domain: 47089+ PTR? 109.34.203.159.in-addr.arpa. (45)
E..I..@.@.'..."mC.C..2.5.5IP.............109.34.203.159.in-addr.arpa.....
18:42:36.556675 IP 67.207.67.2.domain > lamponubuntu2004-s-1vcpu-1gb-tor1-01.43093: 35889 NXDomain 0/1/0 (112)
E...v.@.?.{.C.C..."m.5.U.x...1...........109.34.203.159.in-addr.arpa..............|.7.ns1.digitalocean.com.
hostmaster..a..)..*0.....	:.....
18:42:36.556690 IP lamponubuntu2004-s-1vcpu-1gb-tor1-01.48174 > 67.207.67.2.domain: 23100+ PTR? 109.34.203.159.in-addr.arpa. (45)
E..I..@.@.'..."mC.C....5.5IPZ<...........109.34.203.159.in-addr.arpa.....
18:42:36.556831 IP 67.207.67.2.domain > lamponubuntu2004-s-1vcpu-1gb-tor1-01.39474: 47089 NXDomain 0/1/0 (112)
E...v.@.?.{.C.C..."m.5.2.x.).............109.34.203.159.in-addr.arpa..............|.7.ns1.digitalocean.com.
hostmaster..a..)..*0.....	:.....
18:42:36.557034 IP 67.207.67.2.domain > lamponubuntu2004-s-1vcpu-1gb-tor1-01.48174: 23100 NXDomain 0/1/0 (112)
E...v.@.?.{.C.C..."m.5...x..Z<...........109.34.203.159.in-addr.arpa..............|.7.ns1.digitalocean.com.
hostmaster..a..)..*0.....	:.....
18:42:36.557784 IP lamponubuntu2004-s-1vcpu-1gb-tor1-01.ssh > bras-base-toroon0560w-grc-73-184-146-17-164.dsl.bell.ca.36152: Flags [P.], seq 288:572, ack 1, win 501, options [nop,nop,TS val 844023174 ecr 3768146667], length 284
E..P^W@.@.N..."m.......8..,._.{i...........
2N....Z.Ch..~..f?.(.H..YX....4..I.....L.L.g.i.J.l..Yk/...G...]w....[....T...x..>.|....&r.o8...........o. aE.N.GL..4(4 ..x.<.........D"....q.7..Y.H.Q..;..C../.Z....y....j7FU..'../UP...@.\.|..w....-}W.......a..]}Wc..Y..s.....kq..=.+.....A.Jpc..1.n.....^X.@`..M...=..R..g-.*....RLz..B..s..J.,&..
18:42:36.557906 IP lamponubuntu2004-s-1vcpu-1gb-tor1-01.ssh > bras-base-toroon0560w-grc-73-184-146-17-164.dsl.bell.ca.36152: Flags [P.], seq 572:608, ack 1, win 501, options [nop,nop,TS val 844023174 ecr 3768146667], length 36
E..X^X@.@.O..."m.......8...._.{i...........
2N....Z.G..Z..R...;......=5..t.:q....>..MJ..
18:42:36.558019 IP lamponubuntu2004-s-1vcpu-1gb-tor1-01.ssh > bras-base-toroon0560w-grc-73-184-146-17-164.dsl.bell.ca.36152: Flags [P.], seq 608:692, ack 1, win 501, options [nop,nop,TS val 844023174 ecr 3768146667], length 84
E...^Y@.@.O..."m.......8...)_.{i...........
2N....Z.T<...-.....*...gO{,..Ul....a.."mV..-...e.`.......;.........~z.	..).|P_...qi..:cQz+..
18:42:36.558150 IP lamponubuntu2004-s-1vcpu-1gb-tor1-01.ssh > bras-base-toroon0560w-grc-73-184-146-17-164.dsl.bell.ca.36152: Flags [P.], seq 692:836, ack 1, win 501, options [nop,nop,TS val 844023174 ecr 3768146667], length 144
E...^Z@.@.O[.."m.......8...}_.{i.....%.....
2N....Z.$.....UIp......aLN.,..L-Y.D...T....;}..W...z.=K.....RQ<. P..F...k...t'..M.../=0....i....+...~..[.7^.@6|.a..}k._..u#..*..2L
.pfR.R>;D.Yqm...hE2..
18:42:36.558244 IP lamponubuntu2004-s-1vcpu-1gb-tor1-01.ssh > bras-base-toroon0560w-grc-73-184-146-17-164.dsl.bell.ca.36152: Flags [P.], seq 836:872, ack 1, win 501, options [nop,nop,TS val 844023174 ecr 3768146667], length 36
E..X^[@.@.O..."m.......8../._.{i...........
2N....Z.....\..l..!n............50.h...w.q..
18:42:36.558380 IP lamponubuntu2004-s-1vcpu-1gb-tor1-01.ssh > bras-base-toroon0560w-grc-73-184-146-17-164.dsl.bell.ca.36152: Flags [P.], seq 872:956, ack 1, win 501, options [nop,nop,TS val 844023174 ecr 3768146667], length 84
E...^\@.@.O..."m.......8../1_.{i...........
2N....Z.O...m.P.P..RL..b7....?..s....\...e.}........'....w.B...,.b.%.p.d..}.^.,&e`k.{m!z.Da|
18:42:36.558470 IP lamponubuntu2004-s-1vcpu-1gb-tor1-01.ssh > bras-base-toroon0560w-grc-73-184-146-17-164.dsl.bell.ca.36152: Flags [P.], seq 956:992, ack 1, win 501, options [nop,nop,TS val 844023174 ecr 3768146667], length 36
E..X^]@.@.O..."m.......8../._.{i...........
2N....Z.ow.....o....GvZ`U.Q......+.....hm.
.
18:42:36.558597 IP lamponubuntu2004-s-1vcpu-1gb-tor1-01.ssh > bras-base-toroon0560w-grc-73-184-146-17-164.dsl.bell.ca.36152: Flags [P.], seq 992:1260, ack 1, win 501, options [nop,nop,TS val 844023175 ecr 3768146667], length 268
E..@^^@.@.N..."m.......8../._.{i...........
2N....Z......}(v?0ziF..Xw{.6.Ei.;%..j..T=.0F..2..r*.]P..^...S".(...{?..&l!....:.OY_.,vx....E......[;......:9vR.[...|..$.*%....e..17.P...F)..R@ C..+..9..+.
.....VF...J:. .......8.;......;..`R;...)
.....^.Bx	....._
...x......OL.Q..'....G..}3*.=...h.$...v.J.".1].}..s..zMK..S.=..
18:42:36.558689 IP lamponubuntu2004-s-1vcpu-1gb-tor1-01.ssh > bras-base-toroon0560w-grc-73-184-146-17-164.dsl.bell.ca.36152: Flags [P.], seq 1260:1296, ack 1, win 501, options [nop,nop,TS val 844023175 ecr 3768146667], length 36
E..X^_@.@.O..."m.......8..0._.{i...........
2N....Z..C.#.y....4l...V.......7j.......'
.U
18:42:36.560013 IP lamponubuntu2004-s-1vcpu-1gb-tor1-01.50003 > 67.207.67.2.domain: 57200+ [1au] PTR? 2.67.207.67.in-addr.arpa. (53)
E..Q..@.@.'..."mC.C..S.5.=IX.p...........2.67.207.67.in-addr.arpa.......)........
18:42:36.560231 IP lamponubuntu2004-s-1vcpu-1gb-tor1-01.54767 > 67.207.67.2.domain: 34912+ [1au] PTR? 2.67.207.67.in-addr.arpa. (53)
E..Q..@.@.'..."mC.C....5.=IX.`...........2.67.207.67.in-addr.arpa.......)........
18:42:36.562404 IP lamponubuntu2004-s-1vcpu-1gb-tor1-01.ssh > bras-base-toroon0560w-grc-73-184-146-17-164.dsl.bell.ca.36152: Flags [P.], seq 2724:2932, ack 1, win 501, options [nop,nop,TS val 844023178 ecr 3768146674], length 208
E...^c@.@.O..."m.......8..6m_.{i.....e.....
2N....Z......q.W...a%.....#,.y1.Q.....81Qz...$....=..@[.....,.A.'.%.......j...........O9........u..i.V...y..DQ..z.qp>....j.....M.. .O.k Z.L...Me.W.m.x.._M....w.....?.......D.....v......88qV.................t.A$6.._F.
18:42:36.562850 IP lamponubuntu2004-s-1vcpu-1gb-tor1-01.ssh > bras-base-toroon0560w-grc-73-184-146-17-164.dsl.bell.ca.36152: Flags [P.], seq 3128:3300, ack 1, win 501, options [nop,nop,TS val 844023179 ecr 3768146674], length 172
E...^g@.@.O2.."m.......8..8._.{i.....A.....
2N....Z.........Z.#......O.2.(.R....H_4.R....5oA....=.9.He.."......u.......(...:.....QG	.+q.)....m..d.a.....u"......-P..&...`0.......e."L5...I.g.`...G...s.....F<r.. ......6...I...n
18:42:36.563162 IP lamponubuntu2004-s-1vcpu-1gb-tor1-01.ssh > bras-base-toroon0560w-grc-73-184-146-17-164.dsl.bell.ca.36152: Flags [P.], seq 3496:3668, ack 1, win 501, options [nop,nop,TS val 844023179 ecr 3768146674], length 172
E...^i@.@.O0.."m.......8..9q_.{i.....A.....
2N....Z.."....E..8....Q.].f...2..\.Kz^.-.5
..4Q....K...-^..p...]+N.=.o&.*td.V.<.......y....X..wt...v..<4.!......3...8{}...r....1.<........j._..a.n	\#?.y[	 ......L._...@qS.....gO;..
18:42:36.563559 IP lamponubuntu2004-s-1vcpu-1gb-tor1-01.ssh > bras-base-toroon0560w-grc-73-184-146-17-164.dsl.bell.ca.36152: Flags [P.], seq 3864:4036, ack 1, win 501, options [nop,nop,TS val 844023180 ecr 3768146674], length 172
E...^m@.@.O,.."m.......8..:._.{i.....A.....
2N....Z...._..S.0.QQ.^.......9.aM @...1..,&..$....5q.G......r....+Pl
:4.......o._.+..l...qO....
\..
./.....oVk>.,.T..n[.F..;...*._.=..Ge....J....k
.....&...Gd......]:ZlL....;..7..
18:42:36.563950 IP lamponubuntu2004-s-1vcpu-1gb-tor1-01.ssh > bras-base-toroon0560w-grc-73-184-146-17-164.dsl.bell.ca.36152: Flags [P.], seq 4232:4428, ack 1, win 501, options [nop,nop,TS val 844023180 ecr 3768146674], length 196
E...^q@.@.O..."m.......8..<Q_.{i.....Y.....
2N....Z..sq+....A...>..w....]C.hA...R.....s..*...}6...^..Qs.d.C|..dXdK......c..#}....m>...[..
.e|../.!.
n...;i{}..IopW...j.....(5.	..j	..w..9.Z...4.8.....|.G.....8.	m1=..q.7C.H......Bn=l..$...s.,.1l..ZC~@