root@lamponubuntu2004-s-1vcpu-1gb-tor1-01:~# tcpdump -i eth0
tcpdump: verbose output suppressed, use -v or -vv for full protocol decode
listening on eth0, link-type EN10MB (Ethernet), capture size 262144 bytes
18:41:13.625968 IP lamponubuntu2004-s-1vcpu-1gb-tor1-01.ssh > bras-base-toroon0560w-grc-73-184-146-17-164.dsl.bell.ca.36152: Flags [P.], seq 3763832509:3763832617, ack 1609526021, win 501, options [nop,nop,TS val 843940242 ecr 3768063728], length 108
18:41:13.626101 IP lamponubuntu2004-s-1vcpu-1gb-tor1-01.ssh > bras-base-toroon0560w-grc-73-184-146-17-164.dsl.bell.ca.36152: Flags [P.], seq 108:144, ack 1, win 501, options [nop,nop,TS val 843940242 ecr 3768063728], length 36
18:41:13.626232 IP lamponubuntu2004-s-1vcpu-1gb-tor1-01.ssh > bras-base-toroon0560w-grc-73-184-146-17-164.dsl.bell.ca.36152: Flags [P.], seq 144:252, ack 1, win 501, options [nop,nop,TS val 843940242 ecr 3768063728], length 108
18:41:13.626338 IP lamponubuntu2004-s-1vcpu-1gb-tor1-01.ssh > bras-base-toroon0560w-grc-73-184-146-17-164.dsl.bell.ca.36152: Flags [P.], seq 252:288, ack 1, win 501, options [nop,nop,TS val 843940242 ecr 3768063728], length 36
18:41:13.627635 IP lamponubuntu2004-s-1vcpu-1gb-tor1-01.44586 > 67.207.67.2.domain: 39663+ [1au] PTR? 164.17.146.184.in-addr.arpa. (56)
18:41:13.627841 IP lamponubuntu2004-s-1vcpu-1gb-tor1-01.57924 > 67.207.67.2.domain: 17847+ [1au] PTR? 164.17.146.184.in-addr.arpa. (56)
18:41:13.628169 IP 67.207.67.2.domain > lamponubuntu2004-s-1vcpu-1gb-tor1-01.44586: 39663 1/0/1 PTR bras-base-toroon0560w-grc-73-184-146-17-164.dsl.bell.ca. (125)
18:41:13.628169 IP 67.207.67.2.domain > lamponubuntu2004-s-1vcpu-1gb-tor1-01.57924: 17847 1/0/1 PTR bras-base-toroon0560w-grc-73-184-146-17-164.dsl.bell.ca. (125)
18:41:13.628202 IP lamponubuntu2004-s-1vcpu-1gb-tor1-01 > 67.207.67.2: ICMP lamponubuntu2004-s-1vcpu-1gb-tor1-01 udp port 44586 unreachable, length 161
18:41:13.628230 IP lamponubuntu2004-s-1vcpu-1gb-tor1-01 > 67.207.67.2: ICMP lamponubuntu2004-s-1vcpu-1gb-tor1-01 udp port 57924 unreachable, length 161
18:41:13.628881 IP lamponubuntu2004-s-1vcpu-1gb-tor1-01.60260 > 67.207.67.2.domain: 57846+ [1au] PTR? 109.34.203.159.in-addr.arpa. (56)
18:41:13.629018 IP lamponubuntu2004-s-1vcpu-1gb-tor1-01.45607 > 67.207.67.2.domain: 51080+ [1au] PTR? 109.34.203.159.in-addr.arpa. (56)
18:41:13.629118 IP 67.207.67.2.domain > lamponubuntu2004-s-1vcpu-1gb-tor1-01.60260: 57846 NXDomain 0/1/1 (123)
18:41:13.629168 IP lamponubuntu2004-s-1vcpu-1gb-tor1-01.39873 > 67.207.67.2.domain: 16643+ [1au] PTR? 109.34.203.159.in-addr.arpa. (56)
18:41:13.629286 IP 67.207.67.2.domain > lamponubuntu2004-s-1vcpu-1gb-tor1-01.45607: 51080 NXDomain 0/1/1 (123)
18:41:13.629436 IP lamponubuntu2004-s-1vcpu-1gb-tor1-01.60260 > 67.207.67.2.domain: 57846+ PTR? 109.34.203.159.in-addr.arpa. (45)
18:41:13.629547 IP lamponubuntu2004-s-1vcpu-1gb-tor1-01.45607 > 67.207.67.2.domain: 51080+ PTR? 109.34.203.159.in-addr.arpa. (45)
18:41:13.629633 IP 67.207.67.2.domain > lamponubuntu2004-s-1vcpu-1gb-tor1-01.60260: 57846 NXDomain 0/1/0 (112)
18:41:13.629759 IP 67.207.67.2.domain > lamponubuntu2004-s-1vcpu-1gb-tor1-01.45607: 51080 NXDomain 0/1/0 (112)
18:41:13.630186 IP bras-base-toroon0560w-grc-73-184-146-17-164.dsl.bell.ca.36152 > lamponubuntu2004-s-1vcpu-1gb-tor1-01.ssh: Flags [.], ack 108, win 7555, options [nop,nop,TS val 3768063742 ecr 843940242], length 0
18:41:13.630187 IP bras-base-toroon0560w-grc-73-184-146-17-164.dsl.bell.ca.36152 > lamponubuntu2004-s-1vcpu-1gb-tor1-01.ssh: Flags [.], ack 144, win 7555, options [nop,nop,TS val 3768063742 ecr 843940242], length 0
18:41:13.630187 IP bras-base-toroon0560w-grc-73-184-146-17-164.dsl.bell.ca.36152 > lamponubuntu2004-s-1vcpu-1gb-tor1-01.ssh: Flags [.], ack 252, win 7555, options [nop,nop,TS val 3768063742 ecr 843940242], length 0
18:41:13.630187 IP bras-base-toroon0560w-grc-73-184-146-17-164.dsl.bell.ca.36152 > lamponubuntu2004-s-1vcpu-1gb-tor1-01.ssh: Flags [.], ack 288, win 7555, options [nop,nop,TS val 3768063742 ecr 843940242], length 0
18:41:13.630317 IP 67.207.67.2.domain > lamponubuntu2004-s-1vcpu-1gb-tor1-01.39873: 16643 NXDomain 0/1/1 (123)
18:41:13.630480 IP lamponubuntu2004-s-1vcpu-1gb-tor1-01.39873 > 67.207.67.2.domain: 16643+ PTR? 109.34.203.159.in-addr.arpa. (45)
18:41:13.631559 IP 67.207.67.2.domain > lamponubuntu2004-s-1vcpu-1gb-tor1-01.39873: 16643 NXDomain 0/1/0 (112)
18:41:13.632339 IP lamponubuntu2004-s-1vcpu-1gb-tor1-01.ssh > bras-base-toroon0560w-grc-73-184-146-17-164.dsl.bell.ca.36152: Flags [P.], seq 288:572, ack 1, win 501, options [nop,nop,TS val 843940248 ecr 3768063742], length 284
18:41:13.632508 IP lamponubuntu2004-s-1vcpu-1gb-tor1-01.ssh > bras-base-toroon0560w-grc-73-184-146-17-164.dsl.bell.ca.36152: Flags [P.], seq 572:868, ack 1, win 501, options [nop,nop,TS val 843940249 ecr 3768063742], length 296
18:41:13.632616 IP lamponubuntu2004-s-1vcpu-1gb-tor1-01.ssh > bras-base-toroon0560w-grc-73-184-146-17-164.dsl.bell.ca.36152: Flags [P.], seq 868:904, ack 1, win 501, options [nop,nop,TS val 843940249 ecr 3768063742], length 36
18:41:13.632739 IP lamponubuntu2004-s-1vcpu-1gb-tor1-01.ssh > bras-base-toroon0560w-grc-73-184-146-17-164.dsl.bell.ca.36152: Flags [P.], seq 904:1172, ack 1, win 501, options [nop,nop,TS val 843940249 ecr 3768063742], length 268
18:41:13.632882 IP lamponubuntu2004-s-1vcpu-1gb-tor1-01.ssh > bras-base-toroon0560w-grc-73-184-146-17-164.dsl.bell.ca.36152: Flags [P.], seq 1172:1468, ack 1, win 501, options [nop,nop,TS val 843940249 ecr 3768063742], length 296
18:41:13.632981 IP lamponubuntu2004-s-1vcpu-1gb-tor1-01.ssh > bras-base-toroon0560w-grc-73-184-146-17-164.dsl.bell.ca.36152: Flags [P.], seq 1468:1504, ack 1, win 501, options [nop,nop,TS val 843940249 ecr 3768063742], length 36
18:41:13.633628 IP lamponubuntu2004-s-1vcpu-1gb-tor1-01.60503 > 67.207.67.2.domain: 16304+ [1au] PTR? 2.67.207.67.in-addr.arpa. (53)
18:41:13.633760 IP lamponubuntu2004-s-1vcpu-1gb-tor1-01.47167 > 67.207.67.2.domain: 22820+ [1au] PTR? 2.67.207.67.in-addr.arpa. (53)
18:41:13.633874 IP lamponubuntu2004-s-1vcpu-1gb-tor1-01.51950 > 67.207.67.2.domain: 65490+ [1au] PTR? 2.67.207.67.in-addr.arpa. (53)
18:41:13.634032 IP 67.207.67.2.domain > lamponubuntu2004-s-1vcpu-1gb-tor1-01.60503: 16304 NXDomain 0/1/1 (120)
18:41:13.636009 IP lamponubuntu2004-s-1vcpu-1gb-tor1-01.ssh > bras-base-toroon0560w-grc-73-184-146-17-164.dsl.bell.ca.36152: Flags [P.], seq 1676:1884, ack 1, win 501, options [nop,nop,TS val 843940252 ecr 3768063742], length 208
18:41:13.636383 IP lamponubuntu2004-s-1vcpu-1gb-tor1-01.ssh > bras-base-toroon0560w-grc-73-184-146-17-164.dsl.bell.ca.36152: Flags [P.], seq 1920:2116, ack 1, win 501, options [nop,nop,TS val 843940252 ecr 3768063749], length 196
18:41:13.636563 IP lamponubuntu2004-s-1vcpu-1gb-tor1-01.ssh > bras-base-toroon0560w-grc-73-184-146-17-164.dsl.bell.ca.36152: Flags [P.], seq 2152:2348, ack 1, win 501, options [nop,nop,TS val 843940253 ecr 3768063749], length 196
18:41:13.636713 IP lamponubuntu2004-s-1vcpu-1gb-tor1-01.ssh > bras-base-toroon0560w-grc-73-184-146-17-164.dsl.bell.ca.36152: Flags [P.], seq 2384:2572, ack 1, win 501, options [nop,nop,TS val 843940253 ecr 3768063749], length 188
18:41:13.636858 IP lamponubuntu2004-s-1vcpu-1gb-tor1-01.ssh > bras-base-toroon0560w-grc-73-184-146-17-164.dsl.bell.ca.36152: Flags [P.], seq 2608:2796, ack 1, win 501, options [nop,nop,TS val 843940253 ecr 3768063749], length 188
18:41:13.637008 IP lamponubuntu2004-s-1vcpu-1gb-tor1-01.ssh > bras-base-toroon0560w-grc-73-184-146-17-164.dsl.bell.ca.36152: Flags [P.], seq 2832:3004, ack 1, win 501, options [nop,nop,TS val 843940253 ecr 3768063749], length 172
18:41:13.637155 IP lamponubuntu2004-s-1vcpu-1gb-tor1-01.ssh > bras-base-toroon0560w-grc-73-184-146-17-164.dsl.bell.ca.36152: Flags [P.], seq 3040:3212, ack 1, win 501, options [nop,nop,TS val 843940253 ecr 3768063749], length 172
18:41:13.637326 IP lamponubuntu2004-s-1vcpu-1gb-tor1-01.ssh > bras-base-toroon0560w-grc-73-184-146-17-164.dsl.bell.ca.36152: Flags [P.], seq 3248:3396, ack 1, win 501, options [nop,nop,TS val 843940253 ecr 3768063749], length 148
18:41:13.640716 IP bras-base-toroon0560w-grc-73-184-146-17-164.dsl.bell.ca.36152 > lamponubuntu2004-s-1vcpu-1gb-tor1-01.ssh: Flags [.], ack 1676, win 7555, options [nop,nop,TS val 3768063753 ecr 843940252], length 0
18:41:13.640717 IP bras-base-toroon0560w-grc-73-184-146-17-164.dsl.bell.ca.36152 > lamponubuntu2004-s-1vcpu-1gb-tor1-01.ssh: Flags [.], ack 1884, win 7554, options [nop,nop,TS val 3768063753 ecr 843940252], length 0
18:41:13.640717 IP bras-base-toroon0560w-grc-73-184-146-17-164.dsl.bell.ca.36152 > lamponubuntu2004-s-1vcpu-1gb-tor1-01.ssh: Flags [.], ack 1920, win 7554, options [nop,nop,TS val 3768063753 ecr 843940252], length 0
18:41:13.640717 IP bras-base-toroon0560w-grc-73-184-146-17-164.dsl.bell.ca.36152 > lamponubuntu2004-s-1vcpu-1gb-tor1-01.ssh: Flags [.], ack 2116, win 7553, options [nop,nop,TS val 3768063753 ecr 843940252], length 0
18:41:13.640717 IP bras-base-toroon0560w-grc-73-184-146-17-164.dsl.bell.ca.36152 > lamponubuntu2004-s-1vcpu-1gb-tor1-01.ssh: Flags [.], ack 2152, win 7553, options [nop,nop,TS val 3768063753 ecr 843940252], length 0
18:41:13.640717 IP bras-base-toroon0560w-grc-73-184-146-17-164.dsl.bell.ca.36152 > lamponubuntu2004-s-1vcpu-1gb-tor1-01.ssh: Flags [.], ack 3396, win 7555, options [nop,nop,TS val 3768063753 ecr 843940253], length 0
18:41:13.640778 IP lamponubuntu2004-s-1vcpu-1gb-tor1-01.ssh > bras-base-toroon0560w-grc-73-184-146-17-164.dsl.bell.ca.36152: Flags [P.], seq 3396:6276, ack 1, win 501, options [nop,nop,TS val 843940257 ecr 3768063753], length 2880
18:41:13.640821 IP lamponubuntu2004-s-1vcpu-1gb-tor1-01.ssh > bras-base-toroon0560w-grc-73-184-146-17-164.dsl.bell.ca.36152: Flags [P.], seq 6276:11368, ack 1, win 501, options [nop,nop,TS val 843940257 ecr 3768063753], length 5092
18:41:13.640984 IP lamponubuntu2004-s-1vcpu-1gb-tor1-01.ssh > bras-base-toroon0560w-grc-73-184-146-17-164.dsl.bell.ca.36152: Flags [P.], seq 11368:11620, ack 1, win 501, options [nop,nop,TS val 843940257 ecr 3768063753], length 252
18:41:13.641081 IP lamponubuntu2004-s-1vcpu-1gb-tor1-01.ssh > bras-base-toroon0560w-grc-73-184-146-17-164.dsl.bell.ca.36152: Flags [P.], seq 11620:11656, ack 1, win 501, options [nop,nop,TS val 843940257 ecr 3768063753], length 36
18:41:13.641205 IP lamponubuntu2004-s-1vcpu-1gb-tor1-01.ssh > bras-base-toroon0560w-grc-73-184-146-17-164.dsl.bell.ca.36152: Flags [P.], seq 11656:11908, ack 1, win 501, options [nop,nop,TS val 843940257 ecr 3768063753], length 252
18:41:13.641405 IP lamponubuntu2004-s-1vcpu-1gb-tor1-01.ssh > bras-base-toroon0560w-grc-73-184-146-17-164.dsl.bell.ca.36152: Flags [P.], seq 11908:11944, ack 1, win 501, options [nop,nop,TS val 843940257 ecr 3768063753], length 36
18:41:13.641572 IP lamponubuntu2004-s-1vcpu-1gb-tor1-01.ssh > bras-base-toroon0560w-grc-73-184-146-17-164.dsl.bell.ca.36152: Flags [P.], seq 11944:12196, ack 1, win 501, options [nop,nop,TS val 843940258 ecr 3768063753], length 252
18:41:13.641679 IP lamponubuntu2004-s-1vcpu-1gb-tor1-01.ssh > bras-base-toroon0560w-grc-73-184-146-17-164.dsl.bell.ca.36152: Flags [P.], seq 12196:12232, ack 1, win 501, options [nop,nop,TS val 843940258 ecr 3768063753], length 36
18:41:13.641808 IP lamponubuntu2004-s-1vcpu-1gb-tor1-01.ssh > bras-base-toroon0560w-grc-73-184-146-17-164.dsl.bell.ca.36152: Flags [P.], seq 12232:12484, ack 1, win 501, options [nop,nop,TS val 843940258 ecr 3768063753], length 252
18:41:13.641900 IP lamponubuntu2004-s-1vcpu-1gb-tor1-01.ssh > bras-base-toroon0560w-grc-73-184-146-17-164.dsl.bell.ca.36152: Flags [P.], seq 12484:12520, ack 1, win 501, options [nop,nop,TS val 843940258 ecr 3768063753], length 36
18:41:13.642017 IP lamponubuntu2004-s-1vcpu-1gb-tor1-01.ssh > bras-base-toroon0560w-grc-73-184-146-17-164.dsl.bell.ca.36152: Flags [P.], seq 12520:12772, ack 1, win 501, options [nop,nop,TS val 843940258 ecr 3768063753], length 252
18:41:13.642165 IP lamponubuntu2004-s-1vcpu-1gb-tor1-01.ssh > bras-base-toroon0560w-grc-73-184-146-17-164.dsl.bell.ca.36152: Flags [P.], seq 12772:12808, ack 1, win 501, options [nop,nop,TS val 843940258 ecr 3768063753], length 36
18:41:13.642332 IP lamponubuntu2004-s-1vcpu-1gb-tor1-01.ssh > bras-base-toroon0560w-grc-73-184-146-17-164.dsl.bell.ca.36152: Flags [P.], seq 12808:13060, ack 1, win 501, options [nop,nop,TS val 843940258 ecr 3768063753], length 252
18:41:13.642427 IP lamponubuntu2004-s-1vcpu-1gb-tor1-01.ssh > bras-base-toroon0560w-grc-73-184-146-17-164.dsl.bell.ca.36152: Flags [P.], seq 13060:13096, ack 1, win 501, options [nop,nop,TS val 843940258 ecr 3768063753], length 36
18:41:13.642594 IP lamponubuntu2004-s-1vcpu-1gb-tor1-01.ssh > bras-base-toroon0560w-grc-73-184-146-17-164.dsl.bell.ca.36152: Flags [P.], seq 13096:13364, ack 1, win 501, options [nop,nop,TS val 843940259 ecr 3768063753], length 268
18:41:13.642690 IP lamponubuntu2004-s-1vcpu-1gb-tor1-01.ssh > bras-base-toroon0560w-grc-73-184-146-17-164.dsl.bell.ca.36152: Flags [P.], seq 13364:13400, ack 1, win 501, options [nop,nop,TS val 843940259 ecr 3768063753], length 36
18:41:13.642804 IP lamponubuntu2004-s-1vcpu-1gb-tor1-01.ssh > bras-base-toroon0560w-grc-73-184-146-17-164.dsl.bell.ca.36152: Flags [P.], seq 13400:13668, ack 1, win 501, options [nop,nop,TS val 843940259 ecr 3768063753], length 268
18:41:13.642897 IP lamponubuntu2004-s-1vcpu-1gb-tor1-01.ssh > bras-base-toroon0560w-grc-73-184-146-17-164.dsl.bell.ca.36152: Flags [P.], seq 13668:13704, ack 1, win 501, options [nop,nop,TS val 843940259 ecr 3768063753], length 36
18:41:13.643015 IP lamponubuntu2004-s-1vcpu-1gb-tor1-01.ssh > bras-base-toroon0560w-grc-73-184-146-17-164.dsl.bell.ca.36152: Flags [P.], seq 13704:13972, ack 1, win 501, options [nop,nop,TS val 843940259 ecr 3768063753], length 268
18:41:13.643105 IP lamponubuntu2004-s-1vcpu-1gb-tor1-01.ssh > bras-base-toroon0560w-grc-73-184-146-17-164.dsl.bell.ca.36152: Flags [P.], seq 13972:14008, ack 1, win 501, options [nop,nop,TS val 843940259 ecr 3768063753], length 36
18:41:13.643214 IP lamponubuntu2004-s-1vcpu-1gb-tor1-01.ssh > bras-base-toroon0560w-grc-73-184-146-17-164.dsl.bell.ca.36152: Flags [P.], seq 14008:14276, ack 1, win 501, options [nop,nop,TS val 843940259 ecr 3768063753], length 268
18:41:13.643303 IP lamponubuntu2004-s-1vcpu-1gb-tor1-01.ssh > bras-base-toroon0560w-grc-73-184-146-17-164.dsl.bell.ca.36152: Flags [P.], seq 14276:14312, ack 1, win 501, options [nop,nop,TS val 843940259 ecr 3768063753], length 36
18:41:13.643415 IP lamponubuntu2004-s-1vcpu-1gb-tor1-01.ssh > bras-base-toroon0560w-grc-73-184-146-17-164.dsl.bell.ca.36152: Flags [P.], seq 14312:14580, ack 1, win 501, options [nop,nop,TS val 843940259 ecr 3768063753], length 268
18:41:13.643502 IP lamponubuntu2004-s-1vcpu-1gb-tor1-01.ssh > bras-base-toroon0560w-grc-73-184-146-17-164.dsl.bell.ca.36152: Flags [P.], seq 14580:14616, ack 1, win 501, options [nop,nop,TS val 843940260 ecr 3768063753], length 36
18:41:13.643613 IP lamponubuntu2004-s-1vcpu-1gb-tor1-01.ssh > bras-base-toroon0560w-grc-73-184-146-17-164.dsl.bell.ca.36152: Flags [P.], seq 14616:14884, ack 1, win 501, options [nop,nop,TS val 843940260 ecr 3768063753], length 268
18:41:13.643700 IP lamponubuntu2004-s-1vcpu-1gb-tor1-01.ssh > bras-base-toroon0560w-grc-73-184-146-17-164.dsl.bell.ca.36152: Flags [P.], seq 14884:14920, ack 1, win 501, options [nop,nop,TS val 843940260 ecr 3768063753], length 36
18:41:13.643808 IP lamponubuntu2004-s-1vcpu-1gb-tor1-01.ssh > bras-base-toroon0560w-grc-73-184-146-17-164.dsl.bell.ca.36152: Flags [P.], seq 14920:15188, ack 1, win 501, options [nop,nop,TS val 843940260 ecr 3768063753], length 268
18:41:13.643898 IP lamponubuntu2004-s-1vcpu-1gb-tor1-01.ssh > bras-base-toroon0560w-grc-73-184-146-17-164.dsl.bell.ca.36152: Flags [P.], seq 15188:15224, ack 1, win 501, options [nop,nop,TS val 843940260 ecr 3768063753], length 36
18:41:13.645444 IP bras-base-toroon0560w-grc-73-184-146-17-164.dsl.bell.ca.36152 > lamponubuntu2004-s-1vcpu-1gb-tor1-01.ssh: Flags [.], ack 11656, win 7544, options [nop,nop,TS val 3768063757 ecr 843940257], length 0
18:41:13.645444 IP bras-base-toroon0560w-grc-73-184-146-17-164.dsl.bell.ca.36152 > lamponubuntu2004-s-1vcpu-1gb-tor1-01.ssh: Flags [.], ack 11908, win 7555, options [nop,nop,TS val 3768063758 ecr 843940257], length 0
18:41:13.645484 IP lamponubuntu2004-s-1vcpu-1gb-tor1-01.ssh > bras-base-toroon0560w-grc-73-184-146-17-164.dsl.bell.ca.36152: Flags [P.], seq 15224:18872, ack 1, win 501, options [nop,nop,TS val 843940261 ecr 3768063757], length 3648
18:41:13.645597 IP lamponubuntu2004-s-1vcpu-1gb-tor1-01.ssh > bras-base-toroon0560w-grc-73-184-146-17-164.dsl.bell.ca.36152: Flags [P.], seq 18872:19140, ack 1, win 501, options [nop,nop,TS val 843940262 ecr 3768063758], length 268
18:41:13.645941 IP lamponubuntu2004-s-1vcpu-1gb-tor1-01.ssh > bras-base-toroon0560w-grc-73-184-146-17-164.dsl.bell.ca.36152: Flags [P.], seq 19140:20576, ack 1, win 501, options [nop,nop,TS val 843940262 ecr 3768063758], length 1436
18:41:13.647072 IP bras-base-toroon0560w-grc-73-184-146-17-164.dsl.bell.ca.36152 > lamponubuntu2004-s-1vcpu-1gb-tor1-01.ssh: Flags [.], ack 14580, win 7555, options [nop,nop,TS val 3768063759 ecr 843940257], length 0
18:41:13.647122 IP lamponubuntu2004-s-1vcpu-1gb-tor1-01.ssh > bras-base-toroon0560w-grc-73-184-146-17-164.dsl.bell.ca.36152: Flags [P.], seq 20576:22212, ack 1, win 501, options [nop,nop,TS val 843940263 ecr 3768063759], length 1636
18:41:13.647397 IP lamponubuntu2004-s-1vcpu-1gb-tor1-01.ssh > bras-base-toroon0560w-grc-73-184-146-17-164.dsl.bell.ca.36152: Flags [P.], seq 22212:22464, ack 1, win 501, options [nop,nop,TS val 843940263 ecr 3768063759], length 252
18:41:13.647579 IP lamponubuntu2004-s-1vcpu-1gb-tor1-01.ssh > bras-base-toroon0560w-grc-73-184-146-17-164.dsl.bell.ca.36152: Flags [P.], seq 22464:22732, ack 1, win 501, options [nop,nop,TS val 843940264 ecr 3768063759], length 268
18:41:13.647770 IP lamponubuntu2004-s-1vcpu-1gb-tor1-01.ssh > bras-base-toroon0560w-grc-73-184-146-17-164.dsl.bell.ca.36152: Flags [P.], seq 22732:23240, ack 1, win 501, options [nop,nop,TS val 843940264 ecr 3768063759], length 508
18:41:13.647907 IP lamponubuntu2004-s-1vcpu-1gb-tor1-01.ssh > bras-base-toroon0560w-grc-73-184-146-17-164.dsl.bell.ca.36152: Flags [P.], seq 23240:23508, ack 1, win 501, options [nop,nop,TS val 843940264 ecr 3768063759], length 268
18:41:13.648099 IP lamponubuntu2004-s-1vcpu-1gb-tor1-01.ssh > bras-base-toroon0560w-grc-73-184-146-17-164.dsl.bell.ca.36152: Flags [P.], seq 23508:23776, ack 1, win 501, options [nop,nop,TS val 843940264 ecr 3768063759], length 268
18:41:13.648258 IP lamponubuntu2004-s-1vcpu-1gb-tor1-01.ssh > bras-base-toroon0560w-grc-73-184-146-17-164.dsl.bell.ca.36152: Flags [P.], seq 23776:24044, ack 1, win 501, options [nop,nop,TS val 843940264 ecr 3768063759], length 268
18:41:13.648428 IP lamponubuntu2004-s-1vcpu-1gb-tor1-01.ssh > bras-base-toroon0560w-grc-73-184-146-17-164.dsl.bell.ca.36152: Flags [P.], seq 24044:24312, ack 1, win 501, options [nop,nop,TS val 843940264 ecr 3768063759], length 268
18:41:13.648531 IP bras-base-toroon0560w-grc-73-184-146-17-164.dsl.bell.ca.36152 > lamponubuntu2004-s-1vcpu-1gb-tor1-01.ssh: Flags [.], ack 15224, win 7555, options [nop,nop,TS val 3768063761 ecr 843940260], length 0
18:41:13.648667 IP lamponubuntu2004-s-1vcpu-1gb-tor1-01.ssh > bras-base-toroon0560w-grc-73-184-146-17-164.dsl.bell.ca.36152: Flags [P.], seq 24312:24804, ack 1, win 501, options [nop,nop,TS val 843940265 ecr 3768063761], length 492
18:41:13.648812 IP lamponubuntu2004-s-1vcpu-1gb-tor1-01.ssh > bras-base-toroon0560w-grc-73-184-146-17-164.dsl.bell.ca.36152: Flags [P.], seq 24804:25072, ack 1, win 501, options [nop,nop,TS val 843940265 ecr 3768063761], length 268
18:41:13.648947 IP lamponubuntu2004-s-1vcpu-1gb-tor1-01.ssh > bras-base-toroon0560w-grc-73-184-146-17-164.dsl.bell.ca.36152: Flags [P.], seq 25072:25340, ack 1, win 501, options [nop,nop,TS val 843940265 ecr 3768063761], length 268
18:41:13.649082 IP lamponubuntu2004-s-1vcpu-1gb-tor1-01.ssh > bras-base-toroon0560w-grc-73-184-146-17-164.dsl.bell.ca.36152: Flags [P.], seq 25340:25608, ack 1, win 501, options [nop,nop,TS val 843940265 ecr 3768063761], length 268
18:41:13.649218 IP lamponubuntu2004-s-1vcpu-1gb-tor1-01.ssh > bras-base-toroon0560w-grc-73-184-146-17-164.dsl.bell.ca.36152: Flags [P.], seq 25608:25876, ack 1, win 501, options [nop,nop,TS val 843940265 ecr 3768063761], length 268
18:41:13.649383 IP lamponubuntu2004-s-1vcpu-1gb-tor1-01.ssh > bras-base-toroon0560w-grc-73-184-146-17-164.dsl.bell.ca.36152: Flags [P.], seq 25876:26144, ack 1, win 501, options [nop,nop,TS val 843940265 ecr 3768063761], length 268
18:41:13.649521 IP lamponubuntu2004-s-1vcpu-1gb-tor1-01.ssh > bras-base-toroon0560w-grc-73-184-146-17-164.dsl.bell.ca.36152: Flags [P.], seq 26144:26412, ack 1, win 501, options [nop,nop,TS val 843940266 ecr 3768063761], length 268
18:41:13.649656 IP lamponubuntu2004-s-1vcpu-1gb-tor1-01.ssh > bras-base-toroon0560w-grc-73-184-146-17-164.dsl.bell.ca.36152: Flags [P.], seq 26412:26680, ack 1, win 501, options [nop,nop,TS val 843940266 ecr 3768063761], length 268
18:41:13.649788 IP lamponubuntu2004-s-1vcpu-1gb-tor1-01.ssh > bras-base-toroon0560w-grc-73-184-146-17-164.dsl.bell.ca.36152: Flags [P.], seq 26680:26948, ack 1, win 501, options [nop,nop,TS val 843940266 ecr 3768063761], length 268
18:41:13.649948 IP lamponubuntu2004-s-1vcpu-1gb-tor1-01.ssh > bras-base-toroon0560w-grc-73-184-146-17-164.dsl.bell.ca.36152: Flags [P.], seq 26948:27216, ack 1, win 501, options [nop,nop,TS val 843940266 ecr 3768063761], length 268
18:41:13.650082 IP lamponubuntu2004-s-1vcpu-1gb-tor1-01.ssh > bras-base-toroon0560w-grc-73-184-146-17-164.dsl.bell.ca.36152: Flags [P.], seq 27216:27484, ack 1, win 501, options [nop,nop,TS val 843940266 ecr 3768063761], length 268
18:41:13.650218 IP lamponubuntu2004-s-1vcpu-1gb-tor1-01.ssh > bras-base-toroon0560w-grc-73-184-146-17-164.dsl.bell.ca.36152: Flags [P.], seq 27484:27752, ack 1, win 501, options [nop,nop,TS val 843940266 ecr 3768063761], length 268
18:41:13.650351 IP lamponubuntu2004-s-1vcpu-1gb-tor1-01.ssh > bras-base-toroon0560w-grc-73-184-146-17-164.dsl.bell.ca.36152: Flags [P.], seq 27752:28020, ack 1, win 501, options [nop,nop,TS val 843940266 ecr 3768063761], length 268
18:41:13.650482 IP lamponubuntu2004-s-1vcpu-1gb-tor1-01.ssh > bras-base-toroon0560w-grc-73-184-146-17-164.dsl.bell.ca.36152: Flags [P.], seq 28020:28288, ack 1, win 501, options [nop,nop,TS val 843940266 ecr 3768063761], length 268
18:41:13.650623 IP lamponubuntu2004-s-1vcpu-1gb-tor1-01.ssh > bras-base-toroon0560w-grc-73-184-146-17-164.dsl.bell.ca.36152: Flags [P.], seq 28288:28556, ack 1, win 501, options [nop,nop,TS val 843940267 ecr 3768063761], length 268
18:41:13.650754 IP lamponubuntu2004-s-1vcpu-1gb-tor1-01.ssh > bras-base-toroon0560w-grc-73-184-146-17-164.dsl.bell.ca.36152: Flags [P.], seq 28556:28824, ack 1, win 501, options [nop,nop,TS val 843940267 ecr 3768063761], length 268
18:41:13.650884 IP lamponubuntu2004-s-1vcpu-1gb-tor1-01.ssh > bras-base-toroon0560w-grc-73-184-146-17-164.dsl.bell.ca.36152: Flags [P.], seq 28824:29092, ack 1, win 501, options [nop,nop,TS val 843940267 ecr 3768063761], length 268
18:41:13.651011 IP lamponubuntu2004-s-1vcpu-1gb-tor1-01.ssh > bras-base-toroon0560w-grc-73-184-146-17-164.dsl.bell.ca.36152: Flags [P.], seq 29092:29360, ack 1, win 501, options [nop,nop,TS val 843940267 ecr 3768063761], length 268
18:41:13.651139 IP lamponubuntu2004-s-1vcpu-1gb-tor1-01.ssh > bras-base-toroon0560w-grc-73-184-146-17-164.dsl.bell.ca.36152: Flags [P.], seq 29360:29628, ack 1, win 501, options [nop,nop,TS val 843940267 ecr 3768063761], length 268
18:41:13.651273 IP lamponubuntu2004-s-1vcpu-1gb-tor1-01.ssh > bras-base-toroon0560w-grc-73-184-146-17-164.dsl.bell.ca.36152: Flags [P.], seq 29628:29896, ack 1, win 501, options [nop,nop,TS val 843940267 ecr 3768063761], length 268
18:41:13.651404 IP lamponubuntu2004-s-1vcpu-1gb-tor1-01.ssh > bras-base-toroon0560w-grc-73-184-146-17-164.dsl.bell.ca.36152: Flags [P.], seq 29896:30164, ack 1, win 501, options [nop,nop,TS val 843940267 ecr 3768063761], length 268
18:41:13.651530 IP lamponubuntu2004-s-1vcpu-1gb-tor1-01.ssh > bras-base-toroon0560w-grc-73-184-146-17-164.dsl.bell.ca.36152: Flags [P.], seq 30164:30432, ack 1, win 501, options [nop,nop,TS val 843940268 ecr 3768063761], length 268
18:41:13.651655 IP lamponubuntu2004-s-1vcpu-1gb-tor1-01.ssh > bras-base-toroon0560w-grc-73-184-146-17-164.dsl.bell.ca.36152: Flags [P.], seq 30432:30700, ack 1, win 501, options [nop,nop,TS val 843940268 ecr 3768063761], length 268
18:41:13.651778 IP lamponubuntu2004-s-1vcpu-1gb-tor1-01.ssh > bras-base-toroon0560w-grc-73-184-146-17-164.dsl.bell.ca.36152: Flags [P.], seq 30700:30968, ack 1, win 501, options [nop,nop,TS val 843940268 ecr 3768063761], length 268
18:41:13.651904 IP lamponubuntu2004-s-1vcpu-1gb-tor1-01.ssh > bras-base-toroon0560w-grc-73-184-146-17-164.dsl.bell.ca.36152: Flags [P.], seq 30968:31236, ack 1, win 501, options [nop,nop,TS val 843940268 ecr 3768063761], length 268
18:41:13.652028 IP lamponubuntu2004-s-1vcpu-1gb-tor1-01.ssh > bras-base-toroon0560w-grc-73-184-146-17-164.dsl.bell.ca.36152: Flags [P.], seq 31236:31504, ack 1, win 501, options [nop,nop,TS val 843940268 ecr 3768063761], length 268
18:41:13.652193 IP lamponubuntu2004-s-1vcpu-1gb-tor1-01.ssh > bras-base-toroon0560w-grc-73-184-146-17-164.dsl.bell.ca.36152: Flags [P.], seq 31504:31772, ack 1, win 501, options [nop,nop,TS val 843940268 ecr 3768063761], length 268
18:41:13.652375 IP lamponubuntu2004-s-1vcpu-1gb-tor1-01.ssh > bras-base-toroon0560w-grc-73-184-146-17-164.dsl.bell.ca.36152: Flags [P.], seq 31772:32040, ack 1, win 501, options [nop,nop,TS val 843940268 ecr 3768063761], length 268
18:41:13.652423 IP bras-base-toroon0560w-grc-73-184-146-17-164.dsl.bell.ca.36152 > lamponubuntu2004-s-1vcpu-1gb-tor1-01.ssh: Flags [.], ack 22464, win 7555, options [nop,nop,TS val 3768063764 ecr 843940261], length 0
18:41:13.652424 IP bras-base-toroon0560w-grc-73-184-146-17-164.dsl.bell.ca.36152 > lamponubuntu2004-s-1vcpu-1gb-tor1-01.ssh: Flags [.], ack 23776, win 7545, options [nop,nop,TS val 3768063765 ecr 843940264], length 0
18:41:13.652628 IP lamponubuntu2004-s-1vcpu-1gb-tor1-01.ssh > bras-base-toroon0560w-grc-73-184-146-17-164.dsl.bell.ca.36152: Flags [P.], seq 32040:32748, ack 1, win 501, options [nop,nop,TS val 843940269 ecr 3768063765], length 708
18:41:13.652768 IP lamponubuntu2004-s-1vcpu-1gb-tor1-01.ssh > bras-base-toroon0560w-grc-73-184-146-17-164.dsl.bell.ca.36152: Flags [P.], seq 32748:33016, ack 1, win 501, options [nop,nop,TS val 843940269 ecr 3768063765], length 268
18:41:13.652930 IP lamponubuntu2004-s-1vcpu-1gb-tor1-01.ssh > bras-base-toroon0560w-grc-73-184-146-17-164.dsl.bell.ca.36152: Flags [P.], seq 33016:33284, ack 1, win 501, options [nop,nop,TS val 843940269 ecr 3768063765], length 268
18:41:13.653069 IP lamponubuntu2004-s-1vcpu-1gb-tor1-01.ssh > bras-base-toroon0560w-grc-73-184-146-17-164.dsl.bell.ca.36152: Flags [P.], seq 33284:33552, ack 1, win 501, options [nop,nop,TS val 843940269 ecr 3768063765], length 268
18:41:13.653195 IP lamponubuntu2004-s-1vcpu-1gb-tor1-01.ssh > bras-base-toroon0560w-grc-73-184-146-17-164.dsl.bell.ca.36152: Flags [P.], seq 33552:33820, ack 1, win 501, options [nop,nop,TS val 843940269 ecr 3768063765], length 268
18:41:13.653411 IP lamponubuntu2004-s-1vcpu-1gb-tor1-01.ssh > bras-base-toroon0560w-grc-73-184-146-17-164.dsl.bell.ca.36152: Flags [P.], seq 33820:34088, ack 1, win 501, options [nop,nop,TS val 843940269 ecr 3768063765], length 268
18:41:13.653607 IP lamponubuntu2004-s-1vcpu-1gb-tor1-01.ssh > bras-base-toroon0560w-grc-73-184-146-17-164.dsl.bell.ca.36152: Flags [P.], seq 34088:34356, ack 1, win 501, options [nop,nop,TS val 843940270 ecr 3768063765], length 268
18:41:13.653742 IP lamponubuntu2004-s-1vcpu-1gb-tor1-01.ssh > bras-base-toroon0560w-grc-73-184-146-17-164.dsl.bell.ca.36152: Flags [P.], seq 34356:34624, ack 1, win 501, options [nop,nop,TS val 843940270 ecr 3768063765], length 268
18:41:13.653889 IP lamponubuntu2004-s-1vcpu-1gb-tor1-01.ssh > bras-base-toroon0560w-grc-73-184-146-17-164.dsl.bell.ca.36152: Flags [P.], seq 34624:34892, ack 1, win 501, options [nop,nop,TS val 843940270 ecr 3768063765], length 268
18:41:13.653931 IP bras-base-toroon0560w-grc-73-184-146-17-164.dsl.bell.ca.36152 > lamponubuntu2004-s-1vcpu-1gb-tor1-01.ssh: Flags [.], ack 25340, win 7555, options [nop,nop,TS val 3768063766 ecr 843940264], length 0
18:41:13.653931 IP bras-base-toroon0560w-grc-73-184-146-17-164.dsl.bell.ca.36152 > lamponubuntu2004-s-1vcpu-1gb-tor1-01.ssh: Flags [.], ack 26144, win 7555, options [nop,nop,TS val 3768063766 ecr 843940265], length 0
18:41:13.654114 IP lamponubuntu2004-s-1vcpu-1gb-tor1-01.ssh > bras-base-toroon0560w-grc-73-184-146-17-164.dsl.bell.ca.36152: Flags [P.], seq 34892:35600, ack 1, win 501, options [nop,nop,TS val 843940270 ecr 3768063766], length 708
18:41:13.654249 IP lamponubuntu2004-s-1vcpu-1gb-tor1-01.ssh > bras-base-toroon0560w-grc-73-184-146-17-164.dsl.bell.ca.36152: Flags [P.], seq 35600:35868, ack 1, win 501, options [nop,nop,TS val 843940270 ecr 3768063766], length 268
18:41:13.654448 IP lamponubuntu2004-s-1vcpu-1gb-tor1-01.ssh > bras-base-toroon0560w-grc-73-184-146-17-164.dsl.bell.ca.36152: Flags [P.], seq 35868:36136, ack 1, win 501, options [nop,nop,TS val 843940270 ecr 3768063766], length 268
18:41:13.654595 IP lamponubuntu2004-s-1vcpu-1gb-tor1-01.ssh > bras-base-toroon0560w-grc-73-184-146-17-164.dsl.bell.ca.36152: Flags [P.], seq 36136:36404, ack 1, win 501, options [nop,nop,TS val 843940271 ecr 3768063766], length 268
18:41:13.654722 IP lamponubuntu2004-s-1vcpu-1gb-tor1-01.ssh > bras-base-toroon0560w-grc-73-184-146-17-164.dsl.bell.ca.36152: Flags [P.], seq 36404:36672, ack 1, win 501, options [nop,nop,TS val 843940271 ecr 3768063766], length 268
18:41:13.654846 IP lamponubuntu2004-s-1vcpu-1gb-tor1-01.ssh > bras-base-toroon0560w-grc-73-184-146-17-164.dsl.bell.ca.36152: Flags [P.], seq 36672:36940, ack 1, win 501, options [nop,nop,TS val 843940271 ecr 3768063766], length 268
18:41:13.654978 IP lamponubuntu2004-s-1vcpu-1gb-tor1-01.ssh > bras-base-toroon0560w-grc-73-184-146-17-164.dsl.bell.ca.36152: Flags [P.], seq 36940:37208, ack 1, win 501, options [nop,nop,TS val 843940271 ecr 3768063766], length 268
18:41:13.655103 IP lamponubuntu2004-s-1vcpu-1gb-tor1-01.ssh > bras-base-toroon0560w-grc-73-184-146-17-164.dsl.bell.ca.36152: Flags [P.], seq 37208:37476, ack 1, win 501, options [nop,nop,TS val 843940271 ecr 3768063766], length 268
18:41:13.655230 IP lamponubuntu2004-s-1vcpu-1gb-tor1-01.ssh > bras-base-toroon0560w-grc-73-184-146-17-164.dsl.bell.ca.36152: Flags [P.], seq 37476:37744, ack 1, win 501, options [nop,nop,TS val 843940271 ecr 3768063766], length 268
18:41:13.655370 IP lamponubuntu2004-s-1vcpu-1gb-tor1-01.ssh > bras-base-toroon0560w-grc-73-184-146-17-164.dsl.bell.ca.36152: Flags [P.], seq 37744:38012, ack 1, win 501, options [nop,nop,TS val 843940271 ecr 3768063766], length 268
18:41:13.655546 IP lamponubuntu2004-s-1vcpu-1gb-tor1-01.ssh > bras-base-toroon0560w-grc-73-184-146-17-164.dsl.bell.ca.36152: Flags [P.], seq 38012:38280, ack 1, win 501, options [nop,nop,TS val 843940272 ecr 3768063766], length 268
18:41:13.655689 IP lamponubuntu2004-s-1vcpu-1gb-tor1-01.ssh > bras-base-toroon0560w-grc-73-184-146-17-164.dsl.bell.ca.36152: Flags [P.], seq 38280:38548, ack 1, win 501, options [nop,nop,TS val 843940272 ecr 3768063766], length 268
18:41:13.655823 IP lamponubuntu2004-s-1vcpu-1gb-tor1-01.ssh > bras-base-toroon0560w-grc-73-184-146-17-164.dsl.bell.ca.36152: Flags [P.], seq 38548:38816, ack 1, win 501, options [nop,nop,TS val 843940272 ecr 3768063766], length 268
18:41:13.655926 IP bras-base-toroon0560w-grc-73-184-146-17-164.dsl.bell.ca.36152 > lamponubuntu2004-s-1vcpu-1gb-tor1-01.ssh: Flags [.], ack 27216, win 7555, options [nop,nop,TS val 3768063768 ecr 843940266], length 0
18:41:13.655926 IP bras-base-toroon0560w-grc-73-184-146-17-164.dsl.bell.ca.36152 > lamponubuntu2004-s-1vcpu-1gb-tor1-01.ssh: Flags [.], ack 28824, win 7555, options [nop,nop,TS val 3768063768 ecr 843940266], length 0
18:41:13.655926 IP bras-base-toroon0560w-grc-73-184-146-17-164.dsl.bell.ca.36152 > lamponubuntu2004-s-1vcpu-1gb-tor1-01.ssh: Flags [.], ack 29360, win 7555, options [nop,nop,TS val 3768063768 ecr 843940267], length 0
18:41:13.655926 IP bras-base-toroon0560w-grc-73-184-146-17-164.dsl.bell.ca.36152 > lamponubuntu2004-s-1vcpu-1gb-tor1-01.ssh: Flags [.], ack 30164, win 7555, options [nop,nop,TS val 3768063768 ecr 843940267], length 0
18:41:13.655926 IP bras-base-toroon0560w-grc-73-184-146-17-164.dsl.bell.ca.36152 > lamponubuntu2004-s-1vcpu-1gb-tor1-01.ssh: Flags [P.], seq 1:37, ack 30164, win 7555, options [nop,nop,TS val 3768063768 ecr 843940267], length 36
18:41:13.655926 IP bras-base-toroon0560w-grc-73-184-146-17-164.dsl.bell.ca.36152 > lamponubuntu2004-s-1vcpu-1gb-tor1-01.ssh: Flags [.], ack 32040, win 7555, options [nop,nop,TS val 3768063769 ecr 843940268], length 0
18:41:13.656293 IP lamponubuntu2004-s-1vcpu-1gb-tor1-01.ssh > bras-base-toroon0560w-grc-73-184-146-17-164.dsl.bell.ca.36152: Flags [P.], seq 38816:40404, ack 37, win 501, options [nop,nop,TS val 843940272 ecr 3768063768], length 1588
18:41:13.656507 IP lamponubuntu2004-s-1vcpu-1gb-tor1-01.ssh > bras-base-toroon0560w-grc-73-184-146-17-164.dsl.bell.ca.36152: Flags [P.], seq 40404:40680, ack 37, win 501, options [nop,nop,TS val 843940273 ecr 3768063768], length 276
18:41:13.656656 IP lamponubuntu2004-s-1vcpu-1gb-tor1-01.ssh > bras-base-toroon0560w-grc-73-184-146-17-164.dsl.bell.ca.36152: Flags [P.], seq 40680:40948, ack 37, win 501, options [nop,nop,TS val 843940273 ecr 3768063768], length 268
18:41:13.656794 IP lamponubuntu2004-s-1vcpu-1gb-tor1-01.ssh > bras-base-toroon0560w-grc-73-184-146-17-164.dsl.bell.ca.36152: Flags [P.], seq 40948:41216, ack 37, win 501, options [nop,nop,TS val 843940273 ecr 3768063768], length 268
18:41:13.656929 IP lamponubuntu2004-s-1vcpu-1gb-tor1-01.ssh > bras-base-toroon0560w-grc-73-184-146-17-164.dsl.bell.ca.36152: Flags [P.], seq 41216:41484, ack 37, win 501, options [nop,nop,TS val 843940273 ecr 3768063768], length 268
18:41:13.657064 IP lamponubuntu2004-s-1vcpu-1gb-tor1-01.ssh > bras-base-toroon0560w-grc-73-184-146-17-164.dsl.bell.ca.36152: Flags [P.], seq 41484:41752, ack 37, win 501, options [nop,nop,TS val 843940273 ecr 3768063768], length 268
18:41:13.657196 IP lamponubuntu2004-s-1vcpu-1gb-tor1-01.ssh > bras-base-toroon0560w-grc-73-184-146-17-164.dsl.bell.ca.36152: Flags [P.], seq 41752:42020, ack 37, win 501, options [nop,nop,TS val 843940273 ecr 3768063768], length 268
18:41:13.657321 IP bras-base-toroon0560w-grc-73-184-146-17-164.dsl.bell.ca.36152 > lamponubuntu2004-s-1vcpu-1gb-tor1-01.ssh: Flags [.], ack 33552, win 7555, options [nop,nop,TS val 3768063769 ecr 843940269], length 0
18:41:13.657321 IP bras-base-toroon0560w-grc-73-184-146-17-164.dsl.bell.ca.36152 > lamponubuntu2004-s-1vcpu-1gb-tor1-01.ssh: Flags [.], ack 33820, win 7555, options [nop,nop,TS val 3768063769 ecr 843940269], length 0
18:41:13.657531 IP lamponubuntu2004-s-1vcpu-1gb-tor1-01.ssh > bras-base-toroon0560w-grc-73-184-146-17-164.dsl.bell.ca.36152: Flags [P.], seq 42020:42728, ack 37, win 501, options [nop,nop,TS val 843940274 ecr 3768063769], length 708
18:41:13.657710 IP lamponubuntu2004-s-1vcpu-1gb-tor1-01.ssh > bras-base-toroon0560w-grc-73-184-146-17-164.dsl.bell.ca.36152: Flags [P.], seq 42728:42996, ack 37, win 501, options [nop,nop,TS val 843940274 ecr 3768063769], length 268
18:41:13.657846 IP lamponubuntu2004-s-1vcpu-1gb-tor1-01.ssh > bras-base-toroon0560w-grc-73-184-146-17-164.dsl.bell.ca.36152: Flags [P.], seq 42996:43264, ack 37, win 501, options [nop,nop,TS val 843940274 ecr 3768063769], length 268
18:41:13.657978 IP lamponubuntu2004-s-1vcpu-1gb-tor1-01.ssh > bras-base-toroon0560w-grc-73-184-146-17-164.dsl.bell.ca.36152: Flags [P.], seq 43264:43532, ack 37, win 501, options [nop,nop,TS val 843940274 ecr 3768063769], length 268
18:41:13.658106 IP lamponubuntu2004-s-1vcpu-1gb-tor1-01.ssh > bras-base-toroon0560w-grc-73-184-146-17-164.dsl.bell.ca.36152: Flags [P.], seq 43532:43800, ack 37, win 501, options [nop,nop,TS val 843940274 ecr 3768063769], length 268
18:41:13.658293 IP lamponubuntu2004-s-1vcpu-1gb-tor1-01.ssh > bras-base-toroon0560w-grc-73-184-146-17-164.dsl.bell.ca.36152: Flags [P.], seq 43800:44068, ack 37, win 501, options [nop,nop,TS val 843940274 ecr 3768063769], length 268
18:41:13.658514 IP lamponubuntu2004-s-1vcpu-1gb-tor1-01.ssh > bras-base-toroon0560w-grc-73-184-146-17-164.dsl.bell.ca.36152: Flags [P.], seq 44068:44336, ack 37, win 501, options [nop,nop,TS val 843940275 ecr 3768063769], length 268
18:41:13.658661 IP bras-base-toroon0560w-grc-73-184-146-17-164.dsl.bell.ca.36152 > lamponubuntu2004-s-1vcpu-1gb-tor1-01.ssh: Flags [.], ack 36404, win 7555, options [nop,nop,TS val 3768063771 ecr 843940269], length 0
18:41:13.658662 IP bras-base-toroon0560w-grc-73-184-146-17-164.dsl.bell.ca.36152 > lamponubuntu2004-s-1vcpu-1gb-tor1-01.ssh: Flags [.], ack 38012, win 7555, options [nop,nop,TS val 3768063771 ecr 843940271], length 0
18:41:13.658742 IP lamponubuntu2004-s-1vcpu-1gb-tor1-01.ssh > bras-base-toroon0560w-grc-73-184-146-17-164.dsl.bell.ca.36152: Flags [P.], seq 44336:44604, ack 37, win 501, options [nop,nop,TS val 843940275 ecr 3768063771], length 268
18:41:13.658927 IP lamponubuntu2004-s-1vcpu-1gb-tor1-01.ssh > bras-base-toroon0560w-grc-73-184-146-17-164.dsl.bell.ca.36152: Flags [P.], seq 44604:45312, ack 37, win 501, options [nop,nop,TS val 843940275 ecr 3768063771], length 708
18:41:13.659060 IP lamponubuntu2004-s-1vcpu-1gb-tor1-01.ssh > bras-base-toroon0560w-grc-73-184-146-17-164.dsl.bell.ca.36152: Flags [P.], seq 45312:45580, ack 37, win 501, options [nop,nop,TS val 843940275 ecr 3768063771], length 268
18:41:13.659187 IP lamponubuntu2004-s-1vcpu-1gb-tor1-01.ssh > bras-base-toroon0560w-grc-73-184-146-17-164.dsl.bell.ca.36152: Flags [P.], seq 45580:45848, ack 37, win 501, options [nop,nop,TS val 843940275 ecr 3768063771], length 268
18:41:13.659358 IP lamponubuntu2004-s-1vcpu-1gb-tor1-01.ssh > bras-base-toroon0560w-grc-73-184-146-17-164.dsl.bell.ca.36152: Flags [P.], seq 45848:46116, ack 37, win 501, options [nop,nop,TS val 843940275 ecr 3768063771], length 268
18:41:13.659527 IP lamponubuntu2004-s-1vcpu-1gb-tor1-01.ssh > bras-base-toroon0560w-grc-73-184-146-17-164.dsl.bell.ca.36152: Flags [P.], seq 46116:46384, ack 37, win 501, options [nop,nop,TS val 843940276 ecr 3768063771], length 268
18:41:13.659665 IP lamponubuntu2004-s-1vcpu-1gb-tor1-01.ssh > bras-base-toroon0560w-grc-73-184-146-17-164.dsl.bell.ca.36152: Flags [P.], seq 46384:46652, ack 37, win 501, options [nop,nop,TS val 843940276 ecr 3768063771], length 268
18:41:13.659793 IP lamponubuntu2004-s-1vcpu-1gb-tor1-01.ssh > bras-base-toroon0560w-grc-73-184-146-17-164.dsl.bell.ca.36152: Flags [P.], seq 46652:46920, ack 37, win 501, options [nop,nop,TS val 843940276 ecr 3768063771], length 268
18:41:13.659928 IP lamponubuntu2004-s-1vcpu-1gb-tor1-01.ssh > bras-base-toroon0560w-grc-73-184-146-17-164.dsl.bell.ca.36152: Flags [P.], seq 46920:47188, ack 37, win 501, options [nop,nop,TS val 843940276 ecr 3768063771], length 268
18:41:13.660088 IP lamponubuntu2004-s-1vcpu-1gb-tor1-01.ssh > bras-base-toroon0560w-grc-73-184-146-17-164.dsl.bell.ca.36152: Flags [P.], seq 47188:47456, ack 37, win 501, options [nop,nop,TS val 843940276 ecr 3768063771], length 268
18:41:13.660236 IP lamponubuntu2004-s-1vcpu-1gb-tor1-01.ssh > bras-base-toroon0560w-grc-73-184-146-17-164.dsl.bell.ca.36152: Flags [P.], seq 47456:47724, ack 37, win 501, options [nop,nop,TS val 843940276 ecr 3768063771], length 268
18:41:13.660370 IP lamponubuntu2004-s-1vcpu-1gb-tor1-01.ssh > bras-base-toroon0560w-grc-73-184-146-17-164.dsl.bell.ca.36152: Flags [P.], seq 47724:47992, ack 37, win 501, options [nop,nop,TS val 843940276 ecr 3768063771], length 268
18:41:13.660508 IP lamponubuntu2004-s-1vcpu-1gb-tor1-01.ssh > bras-base-toroon0560w-grc-73-184-146-17-164.dsl.bell.ca.36152: Flags [P.], seq 47992:48260, ack 37, win 501, options [nop,nop,TS val 843940277 ecr 3768063771], length 268
18:41:13.660652 IP lamponubuntu2004-s-1vcpu-1gb-tor1-01.ssh > bras-base-toroon0560w-grc-73-184-146-17-164.dsl.bell.ca.36152: Flags [P.], seq 48260:48528, ack 37, win 501, options [nop,nop,TS val 843940277 ecr 3768063771], length 268
18:41:13.660796 IP lamponubuntu2004-s-1vcpu-1gb-tor1-01.ssh > bras-base-toroon0560w-grc-73-184-146-17-164.dsl.bell.ca.36152: Flags [P.], seq 48528:48796, ack 37, win 501, options [nop,nop,TS val 843940277 ecr 3768063771], length 268
18:41:13.660928 IP lamponubuntu2004-s-1vcpu-1gb-tor1-01.ssh > bras-base-toroon0560w-grc-73-184-146-17-164.dsl.bell.ca.36152: Flags [P.], seq 48796:49064, ack 37, win 501, options [nop,nop,TS val 843940277 ecr 3768063771], length 268
18:41:13.661063 IP lamponubuntu2004-s-1vcpu-1gb-tor1-01.ssh > bras-base-toroon0560w-grc-73-184-146-17-164.dsl.bell.ca.36152: Flags [P.], seq 49064:49332, ack 37, win 501, options [nop,nop,TS val 843940277 ecr 3768063771], length 268
18:41:13.661157 IP bras-base-toroon0560w-grc-73-184-146-17-164.dsl.bell.ca.36152 > lamponubuntu2004-s-1vcpu-1gb-tor1-01.ssh: Flags [.], ack 41484, win 7544, options [nop,nop,TS val 3768063773 ecr 843940272], length 0
18:41:13.661157 IP bras-base-toroon0560w-grc-73-184-146-17-164.dsl.bell.ca.36152 > lamponubuntu2004-s-1vcpu-1gb-tor1-01.ssh: Flags [.], ack 42020, win 7555, options [nop,nop,TS val 3768063773 ecr 843940273], length 0
18:41:13.661321 IP lamponubuntu2004-s-1vcpu-1gb-tor1-01.ssh > bras-base-toroon0560w-grc-73-184-146-17-164.dsl.bell.ca.36152: Flags [P.], seq 49332:50040, ack 37, win 501, options [nop,nop,TS val 843940277 ecr 3768063773], length 708
18:41:13.661462 IP lamponubuntu2004-s-1vcpu-1gb-tor1-01.ssh > bras-base-toroon0560w-grc-73-184-146-17-164.dsl.bell.ca.36152: Flags [P.], seq 50040:50308, ack 37, win 501, options [nop,nop,TS val 843940277 ecr 3768063773], length 268
18:41:13.661597 IP lamponubuntu2004-s-1vcpu-1gb-tor1-01.ssh > bras-base-toroon0560w-grc-73-184-146-17-164.dsl.bell.ca.36152: Flags [P.], seq 50308:50576, ack 37, win 501, options [nop,nop,TS val 843940278 ecr 3768063773], length 268
18:41:13.661733 IP lamponubuntu2004-s-1vcpu-1gb-tor1-01.ssh > bras-base-toroon0560w-grc-73-184-146-17-164.dsl.bell.ca.36152: Flags [P.], seq 50576:50844, ack 37, win 501, options [nop,nop,TS val 843940278 ecr 3768063773], length 268
18:41:13.661868 IP lamponubuntu2004-s-1vcpu-1gb-tor1-01.ssh > bras-base-toroon0560w-grc-73-184-146-17-164.dsl.bell.ca.36152: Flags [P.], seq 50844:51112, ack 37, win 501, options [nop,nop,TS val 843940278 ecr 3768063773], length 268
18:41:13.662158 IP lamponubuntu2004-s-1vcpu-1gb-tor1-01.ssh > bras-base-toroon0560w-grc-73-184-146-17-164.dsl.bell.ca.36152: Flags [P.], seq 51112:51380, ack 37, win 501, options [nop,nop,TS val 843940278 ecr 3768063773], length 268
18:41:13.662297 IP lamponubuntu2004-s-1vcpu-1gb-tor1-01.ssh > bras-base-toroon0560w-grc-73-184-146-17-164.dsl.bell.ca.36152: Flags [P.], seq 51380:51648, ack 37, win 501, options [nop,nop,TS val 843940278 ecr 3768063773], length 268
18:41:13.662424 IP lamponubuntu2004-s-1vcpu-1gb-tor1-01.ssh > bras-base-toroon0560w-grc-73-184-146-17-164.dsl.bell.ca.36152: Flags [P.], seq 51648:51916, ack 37, win 501, options [nop,nop,TS val 843940278 ecr 3768063773], length 268
18:41:13.662532 IP bras-base-toroon0560w-grc-73-184-146-17-164.dsl.bell.ca.36152 > lamponubuntu2004-s-1vcpu-1gb-tor1-01.ssh: Flags [.], ack 44604, win 7555, options [nop,nop,TS val 3768063775 ecr 843940274], length 0
18:41:13.662533 IP bras-base-toroon0560w-grc-73-184-146-17-164.dsl.bell.ca.36152 > lamponubuntu2004-s-1vcpu-1gb-tor1-01.ssh: Flags [.], ack 46116, win 7555, options [nop,nop,TS val 3768063775 ecr 843940275], length 0
18:41:13.662659 IP lamponubuntu2004-s-1vcpu-1gb-tor1-01.ssh > bras-base-toroon0560w-grc-73-184-146-17-164.dsl.bell.ca.36152: Flags [P.], seq 51916:52624, ack 37, win 501, options [nop,nop,TS val 843940279 ecr 3768063775], length 708
18:41:13.662797 IP lamponubuntu2004-s-1vcpu-1gb-tor1-01.ssh > bras-base-toroon0560w-grc-73-184-146-17-164.dsl.bell.ca.36152: Flags [P.], seq 52624:52892, ack 37, win 501, options [nop,nop,TS val 843940279 ecr 3768063775], length 268
18:41:13.662933 IP lamponubuntu2004-s-1vcpu-1gb-tor1-01.ssh > bras-base-toroon0560w-grc-73-184-146-17-164.dsl.bell.ca.36152: Flags [P.], seq 52892:53160, ack 37, win 501, options [nop,nop,TS val 843940279 ecr 3768063775], length 268
18:41:13.663066 IP lamponubuntu2004-s-1vcpu-1gb-tor1-01.ssh > bras-base-toroon0560w-grc-73-184-146-17-164.dsl.bell.ca.36152: Flags [P.], seq 53160:53428, ack 37, win 501, options [nop,nop,TS val 843940279 ecr 3768063775], length 268
18:41:13.663192 IP lamponubuntu2004-s-1vcpu-1gb-tor1-01.ssh > bras-base-toroon0560w-grc-73-184-146-17-164.dsl.bell.ca.36152: Flags [P.], seq 53428:53696, ack 37, win 501, options [nop,nop,TS val 843940279 ecr 3768063775], length 268
18:41:13.663335 IP lamponubuntu2004-s-1vcpu-1gb-tor1-01.ssh > bras-base-toroon0560w-grc-73-184-146-17-164.dsl.bell.ca.36152: Flags [P.], seq 53696:53964, ack 37, win 501, options [nop,nop,TS val 843940279 ecr 3768063775], length 268
18:41:13.663494 IP lamponubuntu2004-s-1vcpu-1gb-tor1-01.ssh > bras-base-toroon0560w-grc-73-184-146-17-164.dsl.bell.ca.36152: Flags [P.], seq 53964:54232, ack 37, win 501, options [nop,nop,TS val 843940279 ecr 3768063775], length 268
18:41:13.663624 IP lamponubuntu2004-s-1vcpu-1gb-tor1-01.ssh > bras-base-toroon0560w-grc-73-184-146-17-164.dsl.bell.ca.36152: Flags [P.], seq 54232:54500, ack 37, win 501, options [nop,nop,TS val 843940280 ecr 3768063775], length 268
18:41:13.663752 IP lamponubuntu2004-s-1vcpu-1gb-tor1-01.ssh > bras-base-toroon0560w-grc-73-184-146-17-164.dsl.bell.ca.36152: Flags [P.], seq 54500:54768, ack 37, win 501, options [nop,nop,TS val 843940280 ecr 3768063775], length 268
18:41:13.663881 IP lamponubuntu2004-s-1vcpu-1gb-tor1-01.ssh > bras-base-toroon0560w-grc-73-184-146-17-164.dsl.bell.ca.36152: Flags [P.], seq 54768:55036, ack 37, win 501, options [nop,nop,TS val 843940280 ecr 3768063775], length 268
18:41:13.664013 IP lamponubuntu2004-s-1vcpu-1gb-tor1-01.ssh > bras-base-toroon0560w-grc-73-184-146-17-164.dsl.bell.ca.36152: Flags [P.], seq 55036:55304, ack 37, win 501, options [nop,nop,TS val 843940280 ecr 3768063775], length 268
18:41:13.664171 IP lamponubuntu2004-s-1vcpu-1gb-tor1-01.ssh > bras-base-toroon0560w-grc-73-184-146-17-164.dsl.bell.ca.36152: Flags [P.], seq 55304:55572, ack 37, win 501, options [nop,nop,TS val 843940280 ecr 3768063775], length 268
18:41:13.664329 IP lamponubuntu2004-s-1vcpu-1gb-tor1-01.ssh > bras-base-toroon0560w-grc-73-184-146-17-164.dsl.bell.ca.36152: Flags [P.], seq 55572:55840, ack 37, win 501, options [nop,nop,TS val 843940280 ecr 3768063775], length 268
18:41:13.664521 IP lamponubuntu2004-s-1vcpu-1gb-tor1-01.ssh > bras-base-toroon0560w-grc-73-184-146-17-164.dsl.bell.ca.36152: Flags [P.], seq 55840:56108, ack 37, win 501, options [nop,nop,TS val 843940281 ecr 3768063775], length 268
18:41:13.664656 IP lamponubuntu2004-s-1vcpu-1gb-tor1-01.ssh > bras-base-toroon0560w-grc-73-184-146-17-164.dsl.bell.ca.36152: Flags [P.], seq 56108:56376, ack 37, win 501, options [nop,nop,TS val 843940281 ecr 3768063775], length 268
18:41:13.664799 IP bras-base-toroon0560w-grc-73-184-146-17-164.dsl.bell.ca.36152 > lamponubuntu2004-s-1vcpu-1gb-tor1-01.ssh: Flags [.], ack 48260, win 7555, options [nop,nop,TS val 3768063777 ecr 843940276], length 0
18:41:13.664799 IP bras-base-toroon0560w-grc-73-184-146-17-164.dsl.bell.ca.36152 > lamponubuntu2004-s-1vcpu-1gb-tor1-01.ssh: Flags [.], ack 50040, win 7555, options [nop,nop,TS val 3768063777 ecr 843940277], length 0
18:41:13.664824 IP lamponubuntu2004-s-1vcpu-1gb-tor1-01.ssh > bras-base-toroon0560w-grc-73-184-146-17-164.dsl.bell.ca.36152: Flags [P.], seq 56376:56644, ack 37, win 501, options [nop,nop,TS val 843940281 ecr 3768063775], length 268
18:41:13.665008 IP lamponubuntu2004-s-1vcpu-1gb-tor1-01.ssh > bras-base-toroon0560w-grc-73-184-146-17-164.dsl.bell.ca.36152: Flags [P.], seq 56644:57352, ack 37, win 501, options [nop,nop,TS val 843940281 ecr 3768063777], length 708
18:41:13.665151 IP lamponubuntu2004-s-1vcpu-1gb-tor1-01.ssh > bras-base-toroon0560w-grc-73-184-146-17-164.dsl.bell.ca.36152: Flags [P.], seq 57352:57620, ack 37, win 501, options [nop,nop,TS val 843940281 ecr 3768063777], length 268
18:41:13.665314 IP lamponubuntu2004-s-1vcpu-1gb-tor1-01.ssh > bras-base-toroon0560w-grc-73-184-146-17-164.dsl.bell.ca.36152: Flags [P.], seq 57620:57888, ack 37, win 501, options [nop,nop,TS val 843940281 ecr 3768063777], length 268
18:41:13.665445 IP lamponubuntu2004-s-1vcpu-1gb-tor1-01.ssh > bras-base-toroon0560w-grc-73-184-146-17-164.dsl.bell.ca.36152: Flags [P.], seq 57888:58156, ack 37, win 501, options [nop,nop,TS val 843940281 ecr 3768063777], length 268
18:41:13.665571 IP lamponubuntu2004-s-1vcpu-1gb-tor1-01.ssh > bras-base-toroon0560w-grc-73-184-146-17-164.dsl.bell.ca.36152: Flags [P.], seq 58156:58424, ack 37, win 501, options [nop,nop,TS val 843940282 ecr 3768063777], length 268
18:41:13.665707 IP lamponubuntu2004-s-1vcpu-1gb-tor1-01.ssh > bras-base-toroon0560w-grc-73-184-146-17-164.dsl.bell.ca.36152: Flags [P.], seq 58424:58692, ack 37, win 501, options [nop,nop,TS val 843940282 ecr 3768063777], length 268
18:41:13.665894 IP lamponubuntu2004-s-1vcpu-1gb-tor1-01.ssh > bras-base-toroon0560w-grc-73-184-146-17-164.dsl.bell.ca.36152: Flags [P.], seq 58692:58960, ack 37, win 501, options [nop,nop,TS val 843940282 ecr 3768063777], length 268
18:41:13.666071 IP lamponubuntu2004-s-1vcpu-1gb-tor1-01.ssh > bras-base-toroon0560w-grc-73-184-146-17-164.dsl.bell.ca.36152: Flags [P.], seq 58960:59228, ack 37, win 501, options [nop,nop,TS val 843940282 ecr 3768063777], length 268
18:41:13.666216 IP lamponubuntu2004-s-1vcpu-1gb-tor1-01.ssh > bras-base-toroon0560w-grc-73-184-146-17-164.dsl.bell.ca.36152: Flags [P.], seq 59228:59496, ack 37, win 501, options [nop,nop,TS val 843940282 ecr 3768063777], length 268
18:41:13.666380 IP lamponubuntu2004-s-1vcpu-1gb-tor1-01.ssh > bras-base-toroon0560w-grc-73-184-146-17-164.dsl.bell.ca.36152: Flags [P.], seq 59496:59764, ack 37, win 501, options [nop,nop,TS val 843940282 ecr 3768063777], length 268
18:41:13.666574 IP lamponubuntu2004-s-1vcpu-1gb-tor1-01.ssh > bras-base-toroon0560w-grc-73-184-146-17-164.dsl.bell.ca.36152: Flags [P.], seq 59764:60032, ack 37, win 501, options [nop,nop,TS val 843940283 ecr 3768063777], length 268
18:41:13.666739 IP lamponubuntu2004-s-1vcpu-1gb-tor1-01.ssh > bras-base-toroon0560w-grc-73-184-146-17-164.dsl.bell.ca.36152: Flags [P.], seq 60032:60300, ack 37, win 501, options [nop,nop,TS val 843940283 ecr 3768063777], length 268
18:41:13.666875 IP lamponubuntu2004-s-1vcpu-1gb-tor1-01.ssh > bras-base-toroon0560w-grc-73-184-146-17-164.dsl.bell.ca.36152: Flags [P.], seq 60300:60568, ack 37, win 501, options [nop,nop,TS val 843940283 ecr 3768063777], length 268
18:41:13.667003 IP lamponubuntu2004-s-1vcpu-1gb-tor1-01.ssh > bras-base-toroon0560w-grc-73-184-146-17-164.dsl.bell.ca.36152: Flags [P.], seq 60568:60836, ack 37, win 501, options [nop,nop,TS val 843940283 ecr 3768063777], length 268
18:41:13.667139 IP lamponubuntu2004-s-1vcpu-1gb-tor1-01.ssh > bras-base-toroon0560w-grc-73-184-146-17-164.dsl.bell.ca.36152: Flags [P.], seq 60836:61104, ack 37, win 501, options [nop,nop,TS val 843940283 ecr 3768063777], length 268
18:41:13.667319 IP lamponubuntu2004-s-1vcpu-1gb-tor1-01.ssh > bras-base-toroon0560w-grc-73-184-146-17-164.dsl.bell.ca.36152: Flags [P.], seq 61104:61372, ack 37, win 501, options [nop,nop,TS val 843940283 ecr 3768063777], length 268
18:41:13.667457 IP lamponubuntu2004-s-1vcpu-1gb-tor1-01.ssh > bras-base-toroon0560w-grc-73-184-146-17-164.dsl.bell.ca.36152: Flags [P.], seq 61372:61640, ack 37, win 501, options [nop,nop,TS val 843940283 ecr 3768063777], length 268
18:41:13.667585 IP lamponubuntu2004-s-1vcpu-1gb-tor1-01.ssh > bras-base-toroon0560w-grc-73-184-146-17-164.dsl.bell.ca.36152: Flags [P.], seq 61640:61908, ack 37, win 501, options [nop,nop,TS val 843940284 ecr 3768063777], length 268
18:41:13.667716 IP lamponubuntu2004-s-1vcpu-1gb-tor1-01.ssh > bras-base-toroon0560w-grc-73-184-146-17-164.dsl.bell.ca.36152: Flags [P.], seq 61908:62176, ack 37, win 501, options [nop,nop,TS val 843940284 ecr 3768063777], length 268
18:41:13.667844 IP lamponubuntu2004-s-1vcpu-1gb-tor1-01.ssh > bras-base-toroon0560w-grc-73-184-146-17-164.dsl.bell.ca.36152: Flags [P.], seq 62176:62444, ack 37, win 501, options [nop,nop,TS val 843940284 ecr 3768063777], length 268
18:41:13.667968 IP lamponubuntu2004-s-1vcpu-1gb-tor1-01.ssh > bras-base-toroon0560w-grc-73-184-146-17-164.dsl.bell.ca.36152: Flags [P.], seq 62444:62712, ack 37, win 501, options [nop,nop,TS val 843940284 ecr 3768063777], length 268
18:41:13.668124 IP lamponubuntu2004-s-1vcpu-1gb-tor1-01.ssh > bras-base-toroon0560w-grc-73-184-146-17-164.dsl.bell.ca.36152: Flags [P.], seq 62712:62980, ack 37, win 501, options [nop,nop,TS val 843940284 ecr 3768063777], length 268
18:41:13.668254 IP lamponubuntu2004-s-1vcpu-1gb-tor1-01.ssh > bras-base-toroon0560w-grc-73-184-146-17-164.dsl.bell.ca.36152: Flags [P.], seq 62980:63248, ack 37, win 501, options [nop,nop,TS val 843940284 ecr 3768063777], length 268
18:41:13.668388 IP lamponubuntu2004-s-1vcpu-1gb-tor1-01.ssh > bras-base-toroon0560w-grc-73-184-146-17-164.dsl.bell.ca.36152: Flags [P.], seq 63248:63516, ack 37, win 501, options [nop,nop,TS val 843940284 ecr 3768063777], length 268
18:41:13.668511 IP lamponubuntu2004-s-1vcpu-1gb-tor1-01.ssh > bras-base-toroon0560w-grc-73-184-146-17-164.dsl.bell.ca.36152: Flags [P.], seq 63516:63784, ack 37, win 501, options [nop,nop,TS val 843940285 ecr 3768063777], length 268
18:41:13.668641 IP lamponubuntu2004-s-1vcpu-1gb-tor1-01.ssh > bras-base-toroon0560w-grc-73-184-146-17-164.dsl.bell.ca.36152: Flags [P.], seq 63784:64052, ack 37, win 501, options [nop,nop,TS val 843940285 ecr 3768063777], length 268
18:41:13.668766 IP lamponubuntu2004-s-1vcpu-1gb-tor1-01.ssh > bras-base-toroon0560w-grc-73-184-146-17-164.dsl.bell.ca.36152: Flags [P.], seq 64052:64320, ack 37, win 501, options [nop,nop,TS val 843940285 ecr 3768063777], length 268
18:41:13.668804 IP bras-base-toroon0560w-grc-73-184-146-17-164.dsl.bell.ca.36152 > lamponubuntu2004-s-1vcpu-1gb-tor1-01.ssh: Flags [.], ack 52624, win 7555, options [nop,nop,TS val 3768063779 ecr 843940277], length 0
18:41:13.668804 IP bras-base-toroon0560w-grc-73-184-146-17-164.dsl.bell.ca.36152 > lamponubuntu2004-s-1vcpu-1gb-tor1-01.ssh: Flags [.], ack 53964, win 7555, options [nop,nop,TS val 3768063779 ecr 843940279], length 0
18:41:13.668900 IP bras-base-toroon0560w-grc-73-184-146-17-164.dsl.bell.ca.36152 > lamponubuntu2004-s-1vcpu-1gb-tor1-01.ssh: Flags [.], ack 56108, win 7555, options [nop,nop,TS val 3768063781 ecr 843940279], length 0
18:41:13.668900 IP bras-base-toroon0560w-grc-73-184-146-17-164.dsl.bell.ca.36152 > lamponubuntu2004-s-1vcpu-1gb-tor1-01.ssh: Flags [.], ack 57888, win 7555, options [nop,nop,TS val 3768063781 ecr 843940281], length 0
18:41:13.669078 IP lamponubuntu2004-s-1vcpu-1gb-tor1-01.ssh > bras-base-toroon0560w-grc-73-184-146-17-164.dsl.bell.ca.36152: Flags [P.], seq 64320:65460, ack 37, win 501, options [nop,nop,TS val 843940285 ecr 3768063781], length 1140
18:41:13.669217 IP lamponubuntu2004-s-1vcpu-1gb-tor1-01.ssh > bras-base-toroon0560w-grc-73-184-146-17-164.dsl.bell.ca.36152: Flags [P.], seq 65460:65736, ack 37, win 501, options [nop,nop,TS val 843940285 ecr 3768063781], length 276
18:41:13.669456 IP lamponubuntu2004-s-1vcpu-1gb-tor1-01.ssh > bras-base-toroon0560w-grc-73-184-146-17-164.dsl.bell.ca.36152: Flags [P.], seq 65736:66004, ack 37, win 501, options [nop,nop,TS val 843940285 ecr 3768063781], length 268
18:41:13.669601 IP lamponubuntu2004-s-1vcpu-1gb-tor1-01.ssh > bras-base-toroon0560w-grc-73-184-146-17-164.dsl.bell.ca.36152: Flags [P.], seq 66004:66272, ack 37, win 501, options [nop,nop,TS val 843940286 ecr 3768063781], length 268
18:41:13.669735 IP lamponubuntu2004-s-1vcpu-1gb-tor1-01.ssh > bras-base-toroon0560w-grc-73-184-146-17-164.dsl.bell.ca.36152: Flags [P.], seq 66272:66540, ack 37, win 501, options [nop,nop,TS val 843940286 ecr 3768063781], length 268
18:41:13.669864 IP lamponubuntu2004-s-1vcpu-1gb-tor1-01.ssh > bras-base-toroon0560w-grc-73-184-146-17-164.dsl.bell.ca.36152: Flags [P.], seq 66540:66808, ack 37, win 501, options [nop,nop,TS val 843940286 ecr 3768063781], length 268
18:41:13.669991 IP lamponubuntu2004-s-1vcpu-1gb-tor1-01.ssh > bras-base-toroon0560w-grc-73-184-146-17-164.dsl.bell.ca.36152: Flags [P.], seq 66808:67076, ack 37, win 501, options [nop,nop,TS val 843940286 ecr 3768063781], length 268
18:41:13.670139 IP lamponubuntu2004-s-1vcpu-1gb-tor1-01.ssh > bras-base-toroon0560w-grc-73-184-146-17-164.dsl.bell.ca.36152: Flags [P.], seq 67076:67344, ack 37, win 501, options [nop,nop,TS val 843940286 ecr 3768063781], length 268
18:41:13.670307 IP lamponubuntu2004-s-1vcpu-1gb-tor1-01.ssh > bras-base-toroon0560w-grc-73-184-146-17-164.dsl.bell.ca.36152: Flags [P.], seq 67344:67612, ack 37, win 501, options [nop,nop,TS val 843940286 ecr 3768063781], length 268
18:41:13.670449 IP lamponubuntu2004-s-1vcpu-1gb-tor1-01.ssh > bras-base-toroon0560w-grc-73-184-146-17-164.dsl.bell.ca.36152: Flags [P.], seq 67612:67880, ack 37, win 501, options [nop,nop,TS val 843940286 ecr 3768063781], length 268
18:41:13.670626 IP lamponubuntu2004-s-1vcpu-1gb-tor1-01.ssh > bras-base-toroon0560w-grc-73-184-146-17-164.dsl.bell.ca.36152: Flags [P.], seq 67880:68148, ack 37, win 501, options [nop,nop,TS val 843940287 ecr 3768063781], length 268
18:41:13.670787 IP lamponubuntu2004-s-1vcpu-1gb-tor1-01.ssh > bras-base-toroon0560w-grc-73-184-146-17-164.dsl.bell.ca.36152: Flags [P.], seq 68148:68416, ack 37, win 501, options [nop,nop,TS val 843940287 ecr 3768063781], length 268
18:41:13.670921 IP lamponubuntu2004-s-1vcpu-1gb-tor1-01.ssh > bras-base-toroon0560w-grc-73-184-146-17-164.dsl.bell.ca.36152: Flags [P.], seq 68416:68684, ack 37, win 501, options [nop,nop,TS val 843940287 ecr 3768063781], length 268
18:41:13.671047 IP lamponubuntu2004-s-1vcpu-1gb-tor1-01.ssh > bras-base-toroon0560w-grc-73-184-146-17-164.dsl.bell.ca.36152: Flags [P.], seq 68684:68952, ack 37, win 501, options [nop,nop,TS val 843940287 ecr 3768063781], length 268
18:41:13.671175 IP lamponubuntu2004-s-1vcpu-1gb-tor1-01.ssh > bras-base-toroon0560w-grc-73-184-146-17-164.dsl.bell.ca.36152: Flags [P.], seq 68952:69220, ack 37, win 501, options [nop,nop,TS val 843940287 ecr 3768063781], length 268
18:41:13.671361 IP lamponubuntu2004-s-1vcpu-1gb-tor1-01.ssh > bras-base-toroon0560w-grc-73-184-146-17-164.dsl.bell.ca.36152: Flags [P.], seq 69220:69488, ack 37, win 501, options [nop,nop,TS val 843940287 ecr 3768063781], length 268
18:41:13.671542 IP lamponubuntu2004-s-1vcpu-1gb-tor1-01.ssh > bras-base-toroon0560w-grc-73-184-146-17-164.dsl.bell.ca.36152: Flags [P.], seq 69488:69756, ack 37, win 501, options [nop,nop,TS val 843940288 ecr 3768063781], length 268
18:41:13.671676 IP bras-base-toroon0560w-grc-73-184-146-17-164.dsl.bell.ca.36152 > lamponubuntu2004-s-1vcpu-1gb-tor1-01.ssh: Flags [.], ack 60032, win 7555, options [nop,nop,TS val 3768063784 ecr 843940281], length 0
18:41:13.671676 IP bras-base-toroon0560w-grc-73-184-146-17-164.dsl.bell.ca.36152 > lamponubuntu2004-s-1vcpu-1gb-tor1-01.ssh: Flags [.], ack 61372, win 7555, options [nop,nop,TS val 3768063784 ecr 843940283], length 0
18:41:13.671676 IP bras-base-toroon0560w-grc-73-184-146-17-164.dsl.bell.ca.36152 > lamponubuntu2004-s-1vcpu-1gb-tor1-01.ssh: Flags [.], ack 63516, win 7555, options [nop,nop,TS val 3768063785 ecr 843940283], length 0
18:41:13.671676 IP bras-base-toroon0560w-grc-73-184-146-17-164.dsl.bell.ca.36152 > lamponubuntu2004-s-1vcpu-1gb-tor1-01.ssh: Flags [.], ack 65736, win 7555, options [nop,nop,TS val 3768063785 ecr 843940285], length 0
18:41:13.671891 IP lamponubuntu2004-s-1vcpu-1gb-tor1-01.ssh > bras-base-toroon0560w-grc-73-184-146-17-164.dsl.bell.ca.36152: Flags [P.], seq 69756:70896, ack 37, win 501, options [nop,nop,TS val 843940288 ecr 3768063785], length 1140
18:41:13.672027 IP lamponubuntu2004-s-1vcpu-1gb-tor1-01.ssh > bras-base-toroon0560w-grc-73-184-146-17-164.dsl.bell.ca.36152: Flags [P.], seq 70896:71172, ack 37, win 501, options [nop,nop,TS val 843940288 ecr 3768063785], length 276
18:41:13.672181 IP lamponubuntu2004-s-1vcpu-1gb-tor1-01.ssh > bras-base-toroon0560w-grc-73-184-146-17-164.dsl.bell.ca.36152: Flags [P.], seq 71172:71440, ack 37, win 501, options [nop,nop,TS val 843940288 ecr 3768063785], length 268
18:41:13.672312 IP lamponubuntu2004-s-1vcpu-1gb-tor1-01.ssh > bras-base-toroon0560w-grc-73-184-146-17-164.dsl.bell.ca.36152: Flags [P.], seq 71440:71708, ack 37, win 501, options [nop,nop,TS val 843940288 ecr 3768063785], length 268
18:41:13.672438 IP lamponubuntu2004-s-1vcpu-1gb-tor1-01.ssh > bras-base-toroon0560w-grc-73-184-146-17-164.dsl.bell.ca.36152: Flags [P.], seq 71708:71976, ack 37, win 501, options [nop,nop,TS val 843940288 ecr 3768063785], length 268
18:41:13.672563 IP lamponubuntu2004-s-1vcpu-1gb-tor1-01.ssh > bras-base-toroon0560w-grc-73-184-146-17-164.dsl.bell.ca.36152: Flags [P.], seq 71976:72244, ack 37, win 501, options [nop,nop,TS val 843940289 ecr 3768063785], length 268
18:41:13.672702 IP lamponubuntu2004-s-1vcpu-1gb-tor1-01.ssh > bras-base-toroon0560w-grc-73-184-146-17-164.dsl.bell.ca.36152: Flags [P.], seq 72244:72512, ack 37, win 501, options [nop,nop,TS val 843940289 ecr 3768063785], length 268
18:41:13.672836 IP lamponubuntu2004-s-1vcpu-1gb-tor1-01.ssh > bras-base-toroon0560w-grc-73-184-146-17-164.dsl.bell.ca.36152: Flags [P.], seq 72512:72780, ack 37, win 501, options [nop,nop,TS val 843940289 ecr 3768063785], length 268
18:41:13.672963 IP lamponubuntu2004-s-1vcpu-1gb-tor1-01.ssh > bras-base-toroon0560w-grc-73-184-146-17-164.dsl.bell.ca.36152: Flags [P.], seq 72780:73048, ack 37, win 501, options [nop,nop,TS val 843940289 ecr 3768063785], length 268
18:41:13.673092 IP lamponubuntu2004-s-1vcpu-1gb-tor1-01.ssh > bras-base-toroon0560w-grc-73-184-146-17-164.dsl.bell.ca.36152: Flags [P.], seq 73048:73316, ack 37, win 501, options [nop,nop,TS val 843940289 ecr 3768063785], length 268
18:41:13.673221 IP lamponubuntu2004-s-1vcpu-1gb-tor1-01.ssh > bras-base-toroon0560w-grc-73-184-146-17-164.dsl.bell.ca.36152: Flags [P.], seq 73316:73584, ack 37, win 501, options [nop,nop,TS val 843940289 ecr 3768063785], length 268
18:41:13.673510 IP lamponubuntu2004-s-1vcpu-1gb-tor1-01.ssh > bras-base-toroon0560w-grc-73-184-146-17-164.dsl.bell.ca.36152: Flags [P.], seq 73584:73852, ack 37, win 501, options [nop,nop,TS val 843940290 ecr 3768063785], length 268
18:41:13.673659 IP lamponubuntu2004-s-1vcpu-1gb-tor1-01.ssh > bras-base-toroon0560w-grc-73-184-146-17-164.dsl.bell.ca.36152: Flags [P.], seq 73852:74120, ack 37, win 501, options [nop,nop,TS val 843940290 ecr 3768063785], length 268
18:41:13.673788 IP lamponubuntu2004-s-1vcpu-1gb-tor1-01.ssh > bras-base-toroon0560w-grc-73-184-146-17-164.dsl.bell.ca.36152: Flags [P.], seq 74120:74388, ack 37, win 501, options [nop,nop,TS val 843940290 ecr 3768063785], length 268
18:41:13.673907 IP bras-base-toroon0560w-grc-73-184-146-17-164.dsl.bell.ca.36152 > lamponubuntu2004-s-1vcpu-1gb-tor1-01.ssh: Flags [.], ack 67880, win 7555, options [nop,nop,TS val 3768063787 ecr 843940285], length 0
18:41:13.673907 IP bras-base-toroon0560w-grc-73-184-146-17-164.dsl.bell.ca.36152 > lamponubuntu2004-s-1vcpu-1gb-tor1-01.ssh: Flags [.], ack 69488, win 7555, options [nop,nop,TS val 3768063787 ecr 843940287], length 0
18:41:13.674036 IP lamponubuntu2004-s-1vcpu-1gb-tor1-01.ssh > bras-base-toroon0560w-grc-73-184-146-17-164.dsl.bell.ca.36152: Flags [P.], seq 74388:74656, ack 37, win 501, options [nop,nop,TS val 843940290 ecr 3768063787], length 268
18:41:13.674153 IP lamponubuntu2004-s-1vcpu-1gb-tor1-01.ssh > bras-base-toroon0560w-grc-73-184-146-17-164.dsl.bell.ca.36152: Flags [P.], seq 74656:75132, ack 37, win 501, options [nop,nop,TS val 843940290 ecr 3768063787], length 476
18:41:13.674300 IP lamponubuntu2004-s-1vcpu-1gb-tor1-01.ssh > bras-base-toroon0560w-grc-73-184-146-17-164.dsl.bell.ca.36152: Flags [P.], seq 75132:75668, ack 37, win 501, options [nop,nop,TS val 843940290 ecr 3768063787], length 536
18:41:13.674423 IP lamponubuntu2004-s-1vcpu-1gb-tor1-01.ssh > bras-base-toroon0560w-grc-73-184-146-17-164.dsl.bell.ca.36152: Flags [P.], seq 75668:75936, ack 37, win 501, options [nop,nop,TS val 843940290 ecr 3768063787], length 268
18:41:13.674549 IP lamponubuntu2004-s-1vcpu-1gb-tor1-01.ssh > bras-base-toroon0560w-grc-73-184-146-17-164.dsl.bell.ca.36152: Flags [P.], seq 75936:76204, ack 37, win 501, options [nop,nop,TS val 843940291 ecr 3768063787], length 268
18:41:13.674757 IP lamponubuntu2004-s-1vcpu-1gb-tor1-01.ssh > bras-base-toroon0560w-grc-73-184-146-17-164.dsl.bell.ca.36152: Flags [P.], seq 76204:76472, ack 37, win 501, options [nop,nop,TS val 843940291 ecr 3768063787], length 268
18:41:13.674898 IP lamponubuntu2004-s-1vcpu-1gb-tor1-01.ssh > bras-base-toroon0560w-grc-73-184-146-17-164.dsl.bell.ca.36152: Flags [P.], seq 76472:76740, ack 37, win 501, options [nop,nop,TS val 843940291 ecr 3768063787], length 268
18:41:13.675025 IP lamponubuntu2004-s-1vcpu-1gb-tor1-01.ssh > bras-base-toroon0560w-grc-73-184-146-17-164.dsl.bell.ca.36152: Flags [P.], seq 76740:77008, ack 37, win 501, options [nop,nop,TS val 843940291 ecr 3768063787], length 268
18:41:13.675156 IP lamponubuntu2004-s-1vcpu-1gb-tor1-01.ssh > bras-base-toroon0560w-grc-73-184-146-17-164.dsl.bell.ca.36152: Flags [P.], seq 77008:77276, ack 37, win 501, options [nop,nop,TS val 843940291 ecr 3768063787], length 268
18:41:13.675291 IP lamponubuntu2004-s-1vcpu-1gb-tor1-01.ssh > bras-base-toroon0560w-grc-73-184-146-17-164.dsl.bell.ca.36152: Flags [P.], seq 77276:77544, ack 37, win 501, options [nop,nop,TS val 843940291 ecr 3768063787], length 268
18:41:13.675452 IP lamponubuntu2004-s-1vcpu-1gb-tor1-01.ssh > bras-base-toroon0560w-grc-73-184-146-17-164.dsl.bell.ca.36152: Flags [P.], seq 77544:77812, ack 37, win 501, options [nop,nop,TS val 843940291 ecr 3768063787], length 268
18:41:13.675626 IP lamponubuntu2004-s-1vcpu-1gb-tor1-01.ssh > bras-base-toroon0560w-grc-73-184-146-17-164.dsl.bell.ca.36152: Flags [P.], seq 77812:78080, ack 37, win 501, options [nop,nop,TS val 843940292 ecr 3768063787], length 268
18:41:13.675769 IP lamponubuntu2004-s-1vcpu-1gb-tor1-01.ssh > bras-base-toroon0560w-grc-73-184-146-17-164.dsl.bell.ca.36152: Flags [P.], seq 78080:78348, ack 37, win 501, options [nop,nop,TS val 843940292 ecr 3768063787], length 268
18:41:13.675906 IP lamponubuntu2004-s-1vcpu-1gb-tor1-01.ssh > bras-base-toroon0560w-grc-73-184-146-17-164.dsl.bell.ca.36152: Flags [P.], seq 78348:78616, ack 37, win 501, options [nop,nop,TS val 843940292 ecr 3768063787], length 268
18:41:13.676141 IP lamponubuntu2004-s-1vcpu-1gb-tor1-01.ssh > bras-base-toroon0560w-grc-73-184-146-17-164.dsl.bell.ca.36152: Flags [P.], seq 78616:78884, ack 37, win 501, options [nop,nop,TS val 843940292 ecr 3768063787], length 268
18:41:13.676338 IP lamponubuntu2004-s-1vcpu-1gb-tor1-01.ssh > bras-base-toroon0560w-grc-73-184-146-17-164.dsl.bell.ca.36152: Flags [P.], seq 78884:79152, ack 37, win 501, options [nop,nop,TS val 843940292 ecr 3768063787], length 268
18:41:13.676557 IP lamponubuntu2004-s-1vcpu-1gb-tor1-01.ssh > bras-base-toroon0560w-grc-73-184-146-17-164.dsl.bell.ca.36152: Flags [P.], seq 79152:79420, ack 37, win 501, options [nop,nop,TS val 843940293 ecr 3768063787], length 268
18:41:13.676715 IP lamponubuntu2004-s-1vcpu-1gb-tor1-01.ssh > bras-base-toroon0560w-grc-73-184-146-17-164.dsl.bell.ca.36152: Flags [P.], seq 79420:79688, ack 37, win 501, options [nop,nop,TS val 843940293 ecr 3768063787], length 268
18:41:13.676870 IP lamponubuntu2004-s-1vcpu-1gb-tor1-01.ssh > bras-base-toroon0560w-grc-73-184-146-17-164.dsl.bell.ca.36152: Flags [P.], seq 79688:79956, ack 37, win 501, options [nop,nop,TS val 843940293 ecr 3768063787], length 268
18:41:13.677037 IP lamponubuntu2004-s-1vcpu-1gb-tor1-01.ssh > bras-base-toroon0560w-grc-73-184-146-17-164.dsl.bell.ca.36152: Flags [P.], seq 79956:80224, ack 37, win 501, options [nop,nop,TS val 843940293 ecr 3768063787], length 268
18:41:13.677183 IP bras-base-toroon0560w-grc-73-184-146-17-164.dsl.bell.ca.36152 > lamponubuntu2004-s-1vcpu-1gb-tor1-01.ssh: Flags [.], ack 73584, win 7555, options [nop,nop,TS val 3768063789 ecr 843940288], length 0
18:41:13.677367 IP lamponubuntu2004-s-1vcpu-1gb-tor1-01.ssh > bras-base-toroon0560w-grc-73-184-146-17-164.dsl.bell.ca.36152: Flags [P.], seq 80224:80716, ack 37, win 501, options [nop,nop,TS val 843940293 ecr 3768063789], length 492
18:41:13.677571 IP lamponubuntu2004-s-1vcpu-1gb-tor1-01.ssh > bras-base-toroon0560w-grc-73-184-146-17-164.dsl.bell.ca.36152: Flags [P.], seq 80716:80984, ack 37, win 501, options [nop,nop,TS val 843940294 ecr 3768063789], length 268
18:41:13.677727 IP lamponubuntu2004-s-1vcpu-1gb-tor1-01.ssh > bras-base-toroon0560w-grc-73-184-146-17-164.dsl.bell.ca.36152: Flags [P.], seq 80984:81252, ack 37, win 501, options [nop,nop,TS val 843940294 ecr 3768063789], length 268
18:41:13.677914 IP lamponubuntu2004-s-1vcpu-1gb-tor1-01.ssh > bras-base-toroon0560w-grc-73-184-146-17-164.dsl.bell.ca.36152: Flags [P.], seq 81252:81520, ack 37, win 501, options [nop,nop,TS val 843940294 ecr 3768063789], length 268
18:41:13.678106 IP lamponubuntu2004-s-1vcpu-1gb-tor1-01.ssh > bras-base-toroon0560w-grc-73-184-146-17-164.dsl.bell.ca.36152: Flags [P.], seq 81520:81788, ack 37, win 501, options [nop,nop,TS val 843940294 ecr 3768063789], length 268
18:41:13.678270 IP lamponubuntu2004-s-1vcpu-1gb-tor1-01.ssh > bras-base-toroon0560w-grc-73-184-146-17-164.dsl.bell.ca.36152: Flags [P.], seq 81788:82056, ack 37, win 501, options [nop,nop,TS val 843940294 ecr 3768063789], length 268
18:41:13.678406 IP lamponubuntu2004-s-1vcpu-1gb-tor1-01.ssh > bras-base-toroon0560w-grc-73-184-146-17-164.dsl.bell.ca.36152: Flags [P.], seq 82056:82324, ack 37, win 501, options [nop,nop,TS val 843940294 ecr 3768063789], length 268
18:41:13.678544 IP lamponubuntu2004-s-1vcpu-1gb-tor1-01.ssh > bras-base-toroon0560w-grc-73-184-146-17-164.dsl.bell.ca.36152: Flags [P.], seq 82324:82592, ack 37, win 501, options [nop,nop,TS val 843940295 ecr 3768063789], length 268
18:41:13.678671 IP lamponubuntu2004-s-1vcpu-1gb-tor1-01.ssh > bras-base-toroon0560w-grc-73-184-146-17-164.dsl.bell.ca.36152: Flags [P.], seq 82592:82860, ack 37, win 501, options [nop,nop,TS val 843940295 ecr 3768063789], length 268
18:41:13.678806 IP lamponubuntu2004-s-1vcpu-1gb-tor1-01.ssh > bras-base-toroon0560w-grc-73-184-146-17-164.dsl.bell.ca.36152: Flags [P.], seq 82860:83128, ack 37, win 501, options [nop,nop,TS val 843940295 ecr 3768063789], length 268
18:41:13.678931 IP lamponubuntu2004-s-1vcpu-1gb-tor1-01.ssh > bras-base-toroon0560w-grc-73-184-146-17-164.dsl.bell.ca.36152: Flags [P.], seq 83128:83396, ack 37, win 501, options [nop,nop,TS val 843940295 ecr 3768063789], length 268
18:41:13.679051 IP bras-base-toroon0560w-grc-73-184-146-17-164.dsl.bell.ca.36152 > lamponubuntu2004-s-1vcpu-1gb-tor1-01.ssh: Flags [.], ack 77544, win 7555, options [nop,nop,TS val 3768063791 ecr 843940290], length 0
18:41:13.679110 IP lamponubuntu2004-s-1vcpu-1gb-tor1-01.ssh > bras-base-toroon0560w-grc-73-184-146-17-164.dsl.bell.ca.36152: Flags [P.], seq 83396:83664, ack 37, win 501, options [nop,nop,TS val 843940295 ecr 3768063791], length 268
18:41:13.679259 IP lamponubuntu2004-s-1vcpu-1gb-tor1-01.ssh > bras-base-toroon0560w-grc-73-184-146-17-164.dsl.bell.ca.36152: Flags [P.], seq 83664:84156, ack 37, win 501, options [nop,nop,TS val 843940295 ecr 3768063791], length 492
18:41:13.679424 IP lamponubuntu2004-s-1vcpu-1gb-tor1-01.ssh > bras-base-toroon0560w-grc-73-184-146-17-164.dsl.bell.ca.36152: Flags [P.], seq 84156:84424, ack 37, win 501, options [nop,nop,TS val 843940295 ecr 3768063791], length 268
18:41:13.679565 IP lamponubuntu2004-s-1vcpu-1gb-tor1-01.ssh > bras-base-toroon0560w-grc-73-184-146-17-164.dsl.bell.ca.36152: Flags [P.], seq 84424:84692, ack 37, win 501, options [nop,nop,TS val 843940296 ecr 3768063791], length 268
18:41:13.679712 IP lamponubuntu2004-s-1vcpu-1gb-tor1-01.ssh > bras-base-toroon0560w-grc-73-184-146-17-164.dsl.bell.ca.36152: Flags [P.], seq 84692:84960, ack 37, win 501, options [nop,nop,TS val 843940296 ecr 3768063791], length 268
18:41:13.679875 IP lamponubuntu2004-s-1vcpu-1gb-tor1-01.ssh > bras-base-toroon0560w-grc-73-184-146-17-164.dsl.bell.ca.36152: Flags [P.], seq 84960:85228, ack 37, win 501, options [nop,nop,TS val 843940296 ecr 3768063791], length 268
18:41:13.680016 IP lamponubuntu2004-s-1vcpu-1gb-tor1-01.ssh > bras-base-toroon0560w-grc-73-184-146-17-164.dsl.bell.ca.36152: Flags [P.], seq 85228:85496, ack 37, win 501, options [nop,nop,TS val 843940296 ecr 3768063791], length 268
18:41:13.680173 IP lamponubuntu2004-s-1vcpu-1gb-tor1-01.ssh > bras-base-toroon0560w-grc-73-184-146-17-164.dsl.bell.ca.36152: Flags [P.], seq 85496:85764, ack 37, win 501, options [nop,nop,TS val 843940296 ecr 3768063791], length 268
18:41:13.680302 IP lamponubuntu2004-s-1vcpu-1gb-tor1-01.ssh > bras-base-toroon0560w-grc-73-184-146-17-164.dsl.bell.ca.36152: Flags [P.], seq 85764:86032, ack 37, win 501, options [nop,nop,TS val 843940296 ecr 3768063791], length 268
18:41:13.680427 IP lamponubuntu2004-s-1vcpu-1gb-tor1-01.ssh > bras-base-toroon0560w-grc-73-184-146-17-164.dsl.bell.ca.36152: Flags [P.], seq 86032:86300, ack 37, win 501, options [nop,nop,TS val 843940296 ecr 3768063791], length 268
18:41:13.680562 IP lamponubuntu2004-s-1vcpu-1gb-tor1-01.ssh > bras-base-toroon0560w-grc-73-184-146-17-164.dsl.bell.ca.36152: Flags [P.], seq 86300:86568, ack 37, win 501, options [nop,nop,TS val 843940297 ecr 3768063791], length 268
18:41:13.680690 IP lamponubuntu2004-s-1vcpu-1gb-tor1-01.ssh > bras-base-toroon0560w-grc-73-184-146-17-164.dsl.bell.ca.36152: Flags [P.], seq 86568:86836, ack 37, win 501, options [nop,nop,TS val 843940297 ecr 3768063791], length 268
18:41:13.680846 IP lamponubuntu2004-s-1vcpu-1gb-tor1-01.ssh > bras-base-toroon0560w-grc-73-184-146-17-164.dsl.bell.ca.36152: Flags [P.], seq 86836:87104, ack 37, win 501, options [nop,nop,TS val 843940297 ecr 3768063791], length 268
18:41:13.680972 IP lamponubuntu2004-s-1vcpu-1gb-tor1-01.ssh > bras-base-toroon0560w-grc-73-184-146-17-164.dsl.bell.ca.36152: Flags [P.], seq 87104:87372, ack 37, win 501, options [nop,nop,TS val 843940297 ecr 3768063791], length 268
18:41:13.681162 IP bras-base-toroon0560w-grc-73-184-146-17-164.dsl.bell.ca.36152 > lamponubuntu2004-s-1vcpu-1gb-tor1-01.ssh: Flags [.], ack 80716, win 7555, options [nop,nop,TS val 3768063793 ecr 843940291], length 0
