root@lamponubuntu2004-s-1vcpu-1gb-tor1-01:~# tcpdump -i eth0 port 22
tcpdump: verbose output suppressed, use -v or -vv for full protocol decode
listening on eth0, link-type EN10MB (Ethernet), capture size 262144 bytes
18:46:41.961110 IP lamponubuntu2004-s-1vcpu-1gb-tor1-01.ssh > bras-base-toroon0560w-grc-73-184-146-17-164.dsl.bell.ca.36152: Flags [P.], seq 3769862529:3769862637, ack 1609535309, win 501, options [nop,nop,TS val 844268577 ecr 3768392046], length 108
18:46:41.961324 IP lamponubuntu2004-s-1vcpu-1gb-tor1-01.ssh > bras-base-toroon0560w-grc-73-184-146-17-164.dsl.bell.ca.36152: Flags [P.], seq 108:144, ack 1, win 501, options [nop,nop,TS val 844268577 ecr 3768392046], length 36
18:46:41.961481 IP lamponubuntu2004-s-1vcpu-1gb-tor1-01.ssh > bras-base-toroon0560w-grc-73-184-146-17-164.dsl.bell.ca.36152: Flags [P.], seq 144:252, ack 1, win 501, options [nop,nop,TS val 844268577 ecr 3768392046], length 108
18:46:41.961632 IP lamponubuntu2004-s-1vcpu-1gb-tor1-01.ssh > bras-base-toroon0560w-grc-73-184-146-17-164.dsl.bell.ca.36152: Flags [P.], seq 252:288, ack 1, win 501, options [nop,nop,TS val 844268578 ecr 3768392046], length 36
18:46:41.964221 IP bras-base-toroon0560w-grc-73-184-146-17-164.dsl.bell.ca.36152 > lamponubuntu2004-s-1vcpu-1gb-tor1-01.ssh: Flags [.], ack 108, win 7555, options [nop,nop,TS val 3768392076 ecr 844268577], length 0
18:46:41.966474 IP bras-base-toroon0560w-grc-73-184-146-17-164.dsl.bell.ca.36152 > lamponubuntu2004-s-1vcpu-1gb-tor1-01.ssh: Flags [.], ack 144, win 7555, options [nop,nop,TS val 3768392078 ecr 844268577], length 0
18:46:41.966475 IP bras-base-toroon0560w-grc-73-184-146-17-164.dsl.bell.ca.36152 > lamponubuntu2004-s-1vcpu-1gb-tor1-01.ssh: Flags [.], ack 252, win 7555, options [nop,nop,TS val 3768392078 ecr 844268577], length 0
18:46:41.966475 IP bras-base-toroon0560w-grc-73-184-146-17-164.dsl.bell.ca.36152 > lamponubuntu2004-s-1vcpu-1gb-tor1-01.ssh: Flags [.], ack 288, win 7555, options [nop,nop,TS val 3768392078 ecr 844268578], length 0
18:46:41.966917 IP lamponubuntu2004-s-1vcpu-1gb-tor1-01.ssh > bras-base-toroon0560w-grc-73-184-146-17-164.dsl.bell.ca.36152: Flags [P.], seq 288:572, ack 1, win 501, options [nop,nop,TS val 844268583 ecr 3768392078], length 284
18:46:41.967093 IP lamponubuntu2004-s-1vcpu-1gb-tor1-01.ssh > bras-base-toroon0560w-grc-73-184-146-17-164.dsl.bell.ca.36152: Flags [P.], seq 572:868, ack 1, win 501, options [nop,nop,TS val 844268583 ecr 3768392078], length 296
18:46:41.967202 IP lamponubuntu2004-s-1vcpu-1gb-tor1-01.ssh > bras-base-toroon0560w-grc-73-184-146-17-164.dsl.bell.ca.36152: Flags [P.], seq 868:904, ack 1, win 501, options [nop,nop,TS val 844268583 ecr 3768392078], length 36
18:46:41.967329 IP lamponubuntu2004-s-1vcpu-1gb-tor1-01.ssh > bras-base-toroon0560w-grc-73-184-146-17-164.dsl.bell.ca.36152: Flags [P.], seq 904:1172, ack 1, win 501, options [nop,nop,TS val 844268583 ecr 3768392078], length 268
18:46:41.967478 IP lamponubuntu2004-s-1vcpu-1gb-tor1-01.ssh > bras-base-toroon0560w-grc-73-184-146-17-164.dsl.bell.ca.36152: Flags [P.], seq 1172:1468, ack 1, win 501, options [nop,nop,TS val 844268583 ecr 3768392078], length 296
18:46:41.967574 IP lamponubuntu2004-s-1vcpu-1gb-tor1-01.ssh > bras-base-toroon0560w-grc-73-184-146-17-164.dsl.bell.ca.36152: Flags [P.], seq 1468:1504, ack 1, win 501, options [nop,nop,TS val 844268584 ecr 3768392078], length 36
18:46:41.967702 IP lamponubuntu2004-s-1vcpu-1gb-tor1-01.ssh > bras-base-toroon0560w-grc-73-184-146-17-164.dsl.bell.ca.36152: Flags [P.], seq 1504:1756, ack 1, win 501, options [nop,nop,TS val 844268584 ecr 3768392078], length 252
18:46:41.967797 IP lamponubuntu2004-s-1vcpu-1gb-tor1-01.ssh > bras-base-toroon0560w-grc-73-184-146-17-164.dsl.bell.ca.36152: Flags [P.], seq 1756:1792, ack 1, win 501, options [nop,nop,TS val 844268584 ecr 3768392078], length 36
18:46:41.967915 IP lamponubuntu2004-s-1vcpu-1gb-tor1-01.ssh > bras-base-toroon0560w-grc-73-184-146-17-164.dsl.bell.ca.36152: Flags [P.], seq 1792:2044, ack 1, win 501, options [nop,nop,TS val 844268584 ecr 3768392078], length 252
18:46:41.968006 IP lamponubuntu2004-s-1vcpu-1gb-tor1-01.ssh > bras-base-toroon0560w-grc-73-184-146-17-164.dsl.bell.ca.36152: Flags [P.], seq 2044:2080, ack 1, win 501, options [nop,nop,TS val 844268584 ecr 3768392078], length 36
18:46:41.972796 IP bras-base-toroon0560w-grc-73-184-146-17-164.dsl.bell.ca.36152 > lamponubuntu2004-s-1vcpu-1gb-tor1-01.ssh: Flags [.], ack 572, win 7555, options [nop,nop,TS val 3768392082 ecr 844268583], length 0
18:46:41.972797 IP bras-base-toroon0560w-grc-73-184-146-17-164.dsl.bell.ca.36152 > lamponubuntu2004-s-1vcpu-1gb-tor1-01.ssh: Flags [.], ack 868, win 7553, options [nop,nop,TS val 3768392082 ecr 844268583], length 0
18:46:41.972797 IP bras-base-toroon0560w-grc-73-184-146-17-164.dsl.bell.ca.36152 > lamponubuntu2004-s-1vcpu-1gb-tor1-01.ssh: Flags [.], ack 904, win 7553, options [nop,nop,TS val 3768392082 ecr 844268583], length 0
18:46:41.972797 IP bras-base-toroon0560w-grc-73-184-146-17-164.dsl.bell.ca.36152 > lamponubuntu2004-s-1vcpu-1gb-tor1-01.ssh: Flags [.], ack 1172, win 7551, options [nop,nop,TS val 3768392082 ecr 844268583], length 0
18:46:41.972797 IP bras-base-toroon0560w-grc-73-184-146-17-164.dsl.bell.ca.36152 > lamponubuntu2004-s-1vcpu-1gb-tor1-01.ssh: Flags [.], ack 1468, win 7549, options [nop,nop,TS val 3768392082 ecr 844268583], length 0
18:46:41.972883 IP lamponubuntu2004-s-1vcpu-1gb-tor1-01.ssh > bras-base-toroon0560w-grc-73-184-146-17-164.dsl.bell.ca.36152: Flags [P.], seq 2080:4960, ack 1, win 501, options [nop,nop,TS val 844268589 ecr 3768392082], length 2880
18:46:41.972924 IP lamponubuntu2004-s-1vcpu-1gb-tor1-01.ssh > bras-base-toroon0560w-grc-73-184-146-17-164.dsl.bell.ca.36152: Flags [P.], seq 4960:5688, ack 1, win 501, options [nop,nop,TS val 844268589 ecr 3768392082], length 728
